refID,tokens
A950051,"BARBARA, A, COOK, 1717, ORIOLE, ST, SAN, DIEGO, CA, 92114, 21781556, 19430219"
A950092,"MIGNONNE, S, 101, COLONIAL, DRIV, CORPPELL, TX, 75019, 22196778"
A950105,"ISMAEL, M, JACKSON, 625, EXCELSIOR, RD, PLACEJRVILLE, CALI, 95667, PO, BOX, 1607, PLACERVILLE, CA, 95667, 26294316"
A950230,"MITZI, M, EL, 9733, HILLHAVEN, AVENUE, TUZJUNGA, CALI, 91042, 23047555"
A950312,"SYDNEY, R, MATEO, 8016, RAINFALL, RD, ALVARADO, TEXA, 76009, POZST, 1416, ALVARADO, TX, 76009, 022392157"
A950421,"ATIENZA, 7250, FRANKLIN, AVE, AP, 609, LOS, ANGELGES, CALIF, 90046, PO, OX, 881605, LOS, ANGELES, ACALIF, 90009, 24161071"
A950427,"LORI, M, WILMERDING, 106, MORMON, ST, APT, A, FOLSOM, CA, 95630, 27136370, 19381228"
A950490,"JACY, A, MURPHY, 800, SW, 1ST, CT, BOYNTON, BEACH, FL, 33426, PO, BOX, 243722, BOYNTON, BEACH, FL, 33424, 021909495"
A950497,"P, PEDRJA, 2450, N, CECELIA, AVE, FRESNO, CA, 93722, 21932663"
A950517,"J, L, VILLALVAZO, 14242, ALLAMAND, DRV, CORPUS, CHRISTI, TEXAS, 7841, 22146312, 37484"
A950568,"YOLANDA, E, SEYMOUR, 36463, CHRISTINE, ST, NEWARK, CA, 945Y60, 22459689"
A950699,"Y, R, RICHARDSON, 3632, OLD, KEYSTONE, RD, TARPON, SPRINGS, FL, 34688, 21566386"
A950729,"ALLAN, D, LEE, 2220, ANGELLE, DRIVE, PORT, ARTHUR, TXAS, 77642, 24562786, 1964"
A950793,"LESLIE, G, RAULERSON, 2120, PECAN, CREEK, DR, MESQUITE, TX, 7518Q1, 25653978"
A950846,"MIKE, L, SEYMORU, W214, BEDFORD, FALLS, DR, BERURYVILLE, ARK, 72616, PRO, BOX, 508, BERRYVILLE, AR72616, 1966"
A950871,"J, A, ROBERTPS, 53W23, CHARLOTTE, AVENUE, NEW, PORT, RICHEY, FL, 34652, 22705118, 30661"
A950897,"ROGER, L, BOOHER, 946, JONES, ST, APT, 3, SAN, FRANCISCO, CALI, 94109, O, BOX, 280911, SAN, FRANCISCO, CA, 94128, 24359663"
A950927,"LEBEKA, D, WILLIAMS, 1134, DODGE, AVE, OROVILLE, CA, 95965, 023920858"
A950928,"BRENT, G, WINSTEAD, 4985, E, UWASHINGTON, AVE, FRENO, CALIF, 93727, 24110989"
A950941,"MELISSA, L, POYNTER, 12339, DAISY, FCT, RANCHO, CUCAMONGA, CA, 91739, 024562327"
A951016,"JOSE, M, GONZALEZ, 13607, COTTAGE, ARBOR, CT, SUGAR, LAND, TX, 77478, PO, BOX, 16052, SUGAR, LAND, TEXAS, 77496"
A951025,"CLAIRE, A, GRIESER, 9225, BANCROFT, AVE, APT, A, OAKLAND, CA, 94603, 025805497, 1975"
A951123,"VERONICA, S, GRFAY, 2016, SOMERVYILLE, DR, N, AKELAND, FL, 33815, 22253749, 1976"
A951181,"JOSEPH, C, RAMOS, 9340, NW, 5TH, CT, SUNRISE, FL, 33322, PO, BOX, 451244, SUNRISE, FL, 33324, 24426737"
A951184,"JOSEPH, A, RCOBERTS, 5323, CHRLOTTE, AVE, NEW, PORT, RICHEY, FL, 34652, 022705118"
A951194,"VERONICA, S, GRAY, 10748, CENTRAL, PARK, AVENUO, NEW, PORT, RICHEY, FL, 34655, 22253749"
A951196,"JOFFRE, M, JIMENEZ, 18257, SUGARMAN, ST, TARZANA, CA, 91356, 020483660, 26017"
A951239,"MARY, M, BUETTNER, 21030, LD, PHOENIX, LAKE, ROAD, SONORA, CALIF, 95370, POST, 4542, SONORA, CALIFORNIA, 95370, 23047555"
A951268,"MARIA, S, ABUER, 7851, S, 106TH, AVE, MIAMI, FL, 33173, 21808647, 19380109"
A951353,"JANA, G, LOPEZ, 11Z245, W, ATLANTIC, BOUL, E108, CORAL, SPRINGS, FL, 33071, 23105905"
A951432,"THOMAS, L, POUNDRIS, 3974, 75TH, ST, W, APT, 907, BRADENTON, FLORIDA, 34209, 023346360"
A951461,"THOM, LOPEZ, 2623, FIDDLESTICK, CIRCLE, UTZ, FLA, 33559"
A951473,"SONIA, G, DEGUZMAN, 13840, KENDALE, LAKES, DR, MIAMI, FL, 33183, 24279712"
A951559,"MILLY, M, D, 34328, HEATHER, RIDGE, COURT, LAKE, ELSINORE, CALIF, 92532, 23676101"
A951561,"JOHN, B, MELTON, 558, WEST, PHILADELPHIA, STR, ONTARIO, CALIFORNIA, 91762, 24141223"
A951605,"LUIS, F, REDDISH, 632, E, CENTER, STRT, ANAHEIM, A, CA, 92805, 24508033, 1934"
A951630,"LADASHIA, M, WHITE, 11335, DOVERWOOD, DR, RIVERSIDE, CA, 92505, PO, BX, 52661, RIVERSIDE, CALIFORNIA, 92517, 23876737"
A951638,"TAMMIE, WHITING, 2801, WILLOW, PL, SOUTH, GATE, CA, 90280, 022431637"
A951661,"V, C, PLUIDO, 406, N, RENGSTROFF, AVE, 10, MT, VIEW, CA, 94303"
A951672,"ROCHELLE, V, CALDWELL, 309, EL, CAPITAN, DR, DELANO, CA, 93215, 022127947"
A951699,"MIGNONNE, TEJADA, 126, RADIO, RD, LIVINGSTON, TX, 77351, 22169778"
A951746,"SANDRA, PAINTER, 1406, 12, AST, 25TH, ST, LOS, ANGELES, CA, 90011, 25164380"
A951748,"LISA, M, POYNTER, 4407, 56TH, LN, VERO, BEACH, FLORIDA, 32967, CAALLER, 1896, VERO, BEACH, FLORIDA, 32961, 24562327"
A951752,"MELONY, R, GREGORY, 7904, NW, 71ST, AVE, TAMARAC, FLA, 33321, 26394931"
A951755,"ALEJANDRA, DALDUMYAN, 23075, HIGHWAY, 90, W, RAVENDE, ARKANSAS, 72459, 21409500, 39327"
A951785,"ANDREA, G, DOMINGUEZ, 9999, COLLINS, AVENIDA, APT, 3J, BAL, HARBOUR, XFLA, 33154, 22371866"
A951787,"GERALD, AMEZCUA, 5317, 26TH, ST, LUBBOCK, TEXAS, 79407, POST, OFFICE, 64062, LUBOCK, TX, 79464, 1947"
A951812,"RAMON, I, B, 611, PAT, ROAD, LEESBURG, FLA, 34748, PO, OX, 230, LEESBURG, FLA, 34748, 026805464, 1940"
A951863,"GURVINDER, W, MONTGOMERY, 12127, MALL, BLVD, STE, A137, VICTORVILLE, CA, 92392, 023122472"
A951907,"SEAN, R, SHANZ, 2701, W, WATERS, AVE, APT, 507Q, TAMPA, FL, 3614, 026469483"
A951918,"CLAIRE, A, URIS, 361, TIERRA, HUMEDA, DR, EL, PASO, TX, 79938, 25805497"
A951919,"MARINA, D, STEWART, 109, TWILIGHT, BAY, DR, PANAMA, CITY, BEACH, FL, 32407, 22486936"
A951976,"BARBERY, L, LANTRIP, 6114, RANIER, DR, ORLANDO, FL, 32810, 025576915, 45372"
A951977,"ADNNY, GEOREG, 24316, VISTA, RIDGE, DR, VALENCIA, CA, 91355, 023457706"
A952068,"K, CHRISTIAN, 6705, BEAMER, WAY, RIO, INDA, CA, 95673, 22428219"
A952078,"EMIL, M, HOANG, 7470, MERCEDES, WAY, ROHNERT, PARK, CA, 94928, 21699603, 19400"
A952094,"HEATHER, R, JORDAN, 620, KATHERINEY, DRIVE, MONTEBELLO, CALIFORNIA90640, PO, BOX, 1741, MONTEBELLO, CA, 90640, 24085241"
A952160,"CAROLYN, ERICKSON, 6142, GREENSBORO, WAY, FONTANA, CA, 92336, PO, BOX, 2600, FONTANA, CALI, 92334, 26818151, 1957"
A952180,"PATTY, R, JARAMILLO, 10, ARCH, RIDGE, LOOP, SEFFNER, FLORIDA, 3584, 072094855"
A952226,"ALBERTO, MALKIEWICZ, 936, MCINTOSH, ST, WEST, PALM, BEACH, FL, 33405, PO, BOX, 19053, WEST, PALM, BEACH, FL, 33416, 27111743"
A952335,"WENDY, B, WALTUON, 10386, MILLS, TOWER, D, RANCHO, CORDOVA, CALIFORNIAD, 95670, 042633835"
A952346,"EDWARD, J, DICK, 21, 83RD, ST, HOLMES, BEACH, FLORIDA, 34217"
A952348,"GARLIN, TARINITO, 316, N, SAVANNAH, ST, LOS, ANGELES, CA, 90033"
A952374,"WAYNE, J, 85, HARTUNG, LN, SOMERSET, TEAS, 78069, 24323488"
A952416,"FELICIA, CORNELISSEN, 3221, MONTANA, AVE, COSTA, MESA, CA, 92626, 25407736, 36526"
A952430,"PEDRO, V, FLORES, 9738, HELEN, AVE, SUNLAND, CALIFORNIA, 9040, 25400116"
A952439,"YANNELIS, P, 3852, S, FM, 548, ROYSE, CITY, TX, 75189, 1904"
A952468,"CINDY, K, DAVIS, 106, ROACHE, RD, FREEDOM, CA, 95019, 23394609"
A952491,"BRENDA, B, KRIEGER, 16044, DEVONSHIRE, ST, GRANADA, HILLS, CA, 91344, 24384689"
A952525,"MARY, G, FERGUSON, 3354, USTANG, DR, ONTARIO, CALIF, 91761, PO, BOX, 482, ONTARIO, CA, 91762, 25921664"
A952544,"DENISE, S, MELCHOR, 1553, ALICE, SFT, APT, 207, OAKLAND, CLIFORNIA, 94612, BOX, 18616, OAKLAND, CALI, 94619, 024708795"
A952552,"ANGELA, P, BULBUL, 323, CABLE, DR, SAN, ANTONIO, TX, 78227, 22944337"
A952559,"ANTHONY, A, MARTENS, 31532, VINTNERS, POINTE, CT, WINCHESTER, CA, 92596, 22100234"
A952605,"JANICE, M, WALTON, 238, CONNIE, ST, HOUSTON, TX, 77076, 22551375, 19650105"
A952652,"DZOVINAR, C, EDEN, 6406, GARLINGHOUSE, LANE, DALLAS, TX, 75252, PO, BOX, 810892, DALLAS, TEXAS, 75381, 26373745"
A952707,"LAWRENCE, W, MATASCI, 3871, STTE, HIGHWAY, 88, IONE, CALIFORNIA, 95640, POST, BOX, 47D6, IONE, CA, 95640, 021728108"
A952739,"GARY, VENTURA, 873, CANEEL, BAY, TERRACE, WINTER, SPRINGS, FL, 32708, 026849307"
A952766,"SHARRON, A, LAUDERDALE, 4308, FRED, LANE, MILTON, FL, 32571, POST, OFFIE, BOX, 343, MILTON, FLA, 32572, 023984762"
A952865,"KENNETH, H, OZEN, 3981, E, HIBISCUS, ST, WESTON, FL, 33332, 42344604"
A952930,"ISABEL, P, BATTLES, 33B09, PAULA, AVE, MCLLEN, TEXAS, 78503, APARTADO, 5240, MCALLEN, TX, 78505, 042230419, 1981"
A952931,"JUAN, PALACOIS, 7617, QAIL, RIDGE, ST, FORT, WORTH, TX, 76179, 22929301, 19490225"
A952953,"BONG, S, ALVAERZ, 1025, S, GAGE, AVE, LOS, ANGELES, CA, 90023, 23931317, 1901"
A952959,"LOUIS, DICKS, 708, RUBY, AVE, WACO, TX, 76710, CALLER, 2402, WACO, TX, 76702, 19850606"
A952968,"LEONIDAS, S, CAJINA, 7708, UNIVERSITY, AVE, LA, MESA, CA, 91941, 026629790"
A952983,"ASIYA, MATA, 18329, SIERRA, DR, SONOMA, CA, 95476, 021442444"
A952984,"DONALD, E, REECE, 8201, TOWNE, MAIN, DR, APT, 1426, PLANO, TX, 75024, 24120842, 1945"
A953055,"JOAQUIN, A, HOLZWARTH, JR, 1627C, ARIZONA, AVEN, EL, PASO, TEXAS, 79902, CALL, BOX, 270G96, EL, PASO, TX, 79926, 23179971"
A953056,"JOSE, D, HAYES, 2209, MCLAUGHLIN, AVE, APT, 2, SAN, JOSE, CALIF, 95122, CALLER, 640083, SAN, JOSE, CIA, 95164"
A953077,"M, CATSTORA, 141P2, HOWLIN, WOLF, TRL, PFLUGERVILLE, TX, 78660"
A953119,"CARLOS, B, MACTAL, 808, W, GLDFINCH, AVN, PHARR, TEXAS, 78577, PO, BOX, 1507, PHARR, TX, 78577, 024832454, 1942"
A953131,"MICHELEL, A, FABIAN, 3599, MENDENHALL, CT, PLEASANTON, CA, 9458, 21653937"
A953142,"TERESA, P, PITCHER, 10461, E, CLOVER, LN, FORNEY, TX, 75126, PST, OFFICE, BOX, 21, FORNEY, TX, 75126"
A953160,"JORGE, M, EMERT, 15897, PALM, VISTA, DR, HARLINGEN, TEXAS, 78552"
A953170,"M, BELL, 6529, PUTTING, GREEN, DR, DALLAS, TX, 75232"
A953190,"DANA, L, G, 6367, TOWNSEND, RD, JACKSONVILLE, FL, 32244, 022010354"
A953196,"LAWRENCE, W, MAATSCI, 20, VIA, ALIVIO, RANCHO, SANTA, MARGARITA, CA, 92688"
A953230,"NAWRES, D, CAMPBELL, 130, SUMMER, PLACE, CIR, POTTSBORO, TEXAS, 75076, PO, BOX, 97, POTTSBORO, TEXAS, 75076, 023596485, 1974"
A953249,"A, LITTLE, 30343, STAPLETON, ST, WESLEY, CHAPEL, FL, 33545, 022216418"
A953271,"ROSSIE, A, VASSQUEZ, 4726, AUTUMN, ROSE, T, FAIRFIELD, CA, 94534, 23319210"
A953398,"RACHELLE, F, HASHMI, 2504, HOLLOWAY, AVE, MDLAND, TX, 79701, PO, BOX52534, MIDLAND, TX, 79710, 22339181, 26936"
A953429,"CONSUELO, CANO, 613, 12, MAIN, STREET, LIBERTY, TX, 77575, 022038519"
A953441,"MANIC, L, ALLMON, E171, EDELWEISS, WY, GALT, CA, 95632, 025014581"
A953453,"J, C, RAMOS, 4601, 66TH, STR, WEST, APT, 721A, BRADENTON, FL, 34210, 24426737"
A953512,"BARBARA, A, COOK, 14825, LARTH, AVE, LAWNDALE, CA, 90260, PO, BOX, 804, LAWNDALE, CA, 90260, 21781556"
A953519,"SEAN, PELAYO, 60, INDEPENDENCE, PKWY, UNIT, 1308, PLANO, TEXAS, 7575, 022949203"
A953523,"MILIVOY, S, ROSEMON, 222, DANA, DR, ROWLETT, TEXAS, 7088, 25406930"
A953555,"LEE, S, CAJINA, 7708, UNIVERSITY, AVENU, LA, MESA, CA, 91941, 026629790, 26894"
A953583,"M, S, LANDOW, 609, STABLE, AVME, BAKERSFIELD, CA, 93307, POSTC, OFFICE, 60103, BAKERSFIELD, CALI, 93386"
A953637,"LESLIE, E, PADGETT, 248, S, 45TH, ST, CAPE, CORAL, FL, 33904, 024645972"
A953808,"WENDY, B, GUTIERREZ, 219, ENCINAL, AVE, B, ALAMEDA, CA, 94501, 024633835, 26935"
A953815,"TRACY, E, REECE, 8201, TOWNE, MAIN, DR, APT, 1426, PLANO, TX, 75024"
A953851,"M, C, LOPEZCASTILLO, 2603, CENTRUAL, AVE, UNION, CITY, CA, 94587, PO, BOX, 2929, UNION, CITY, CCALIF, 94587, 025285325"
A953859,"ANN, E, CARPENTER, 300, CALIFORNIA, AVE, APT, 15, SANTA, MONICA, CA, 90403, 027012011"
A953862,"JUNE, LEDEZMA, 2320, CHERRYBROOK, LN, APT, 280, PASADENTA, TEXAS, 77502, 026826120, 1967"
A953908,"JOSE, A, CUNNINGHAM, 1662, KTIGARD, ST, SE, PALM, BAY, FLORIDA, 3209, 1943"
A953911,"EIRC, W, MEYER, 1406, GONDOLA, PARK, DR, VENICE, FL, 34292"
A953969,"M, MILLMAN, 1057, GOLF, VIJEW, ESTATES, DRIVE, EORANGE, CITY, FL, 32763"
A953995,"SAUL, A, SHELTON, 4121, ASTORIA, STRT, IRVING, TEXAS, 750S62, 24268282, 1935"
A954066,"BRUCE, GASDAGLSI, 3831, CASTLE, ROJCK, RD, DIAMOND, BAR, CA, 91765, 023109186"
A954095,"J, K, NEALON, 5962, E, GARLAND, AVIE, FRESNO, CA, 93727, 1942"
A954104,"GUIOMAR, M, FURLONG, 5704, FARREL, WY, MILTON, FL, 32583, POST, OFFICE, 343, MILTON, FL, 32572"
A954117,"JUAN, P, PELAYO, 15009, ALEXANDER, ROAD, SCOTT, AR, 72142, 024264758"
A954135,"ANGEL, SINCLAIR, 1640, SOPHIE, LN, ESCALON, CALIF, 9520, 24450372, 19560303"
A954154,"ELSIE, M, HARRISON, 13515, TEDEMORY, DR, WHITTIER, CA, 90602, 1941"
A954233,"ANDREY, D, SINOR, 18846, SIERRA, ESTATES, DRIV, NEWHALL, CALI, 91321, 028158499"
A954248,"PAUL, G, RYAMOND, 13992, LIBBY, LN, WARD, ARKANSAS, 72176, 021868386"
A954275,"JOHN, R, TREVINO, Z3641, DAHLIA, DR, GRAND, PRAIRIE, TX, 75052, 023846481, 1906"
A954315,"FERDINAND, B, SILVEIRA, 2620, NWB, 55TH, CT, FORT, LAUDERDALE, FL, 33309, APTDO, 22952, FORT, LAUDERDALE, FL, 33335, 24906119"
A954322,"ANGEL, G, RODRIGUEZ, 9305, NWFOUND, WAY, ELK, GROVE, CALIF, 95758, 1945"
A954479,"CARMEN, C, ANGUOL, 1107, HIOLLY, STR, LEVELLAND, TEXAS, 79336"
A954488,"J, D, HAYES, 1773, WEST, EVERGREEN, STREET, RIALTO, CALIF, 9237, POST, OFFICE, BOX, 512, RIALTO, CA, 92377, 25221315"
A954526,"GRISEL, J, GAPOL, 511, N, 1ST, ST, JARRELL, TX, 76537, 023605017"
A954578,"JASON, C, GUY, 7395, EDENFIELD, PARK, RD, JACKSONVILLET, FL, 32244, POBOX, 5314, JACKSONVILLE, FL, 32247, 26512974, 43919"
A954716,"ESTHER, V, CRAIG, 26661, BRANDON, MISSION, VIEJO, CA, 92692, 23148656"
A954753,"GURVINDER, W, M, 12127, MALL, BLVD, STE, A137, VICTORVILLE, CA, 92392"
A954755,"HELOI, E, RIXVERA, 401, WALKER, ST, ARVIN, CA, 93203, 32388816"
A954764,"M, G, FERGUSON, 9613, WYDELLA, ST, RIVERVIEW, FLA, 33569, 025921646"
A954814,"JOSEPH, C, RAMOS, 4601, 66TH, ST, W, APT, 1721A, BRADENTN, FL, 34210"
A954833,"L, F, REDDISH, 45290, ROBINWOOD, CRCL, CALLAHAN, FL, 32011, PO, BO, 2072, CALAHAN, FLA, 32011, 24508033, 19340116"
A954979,"PELAYO, 5839, GRAMNT, ST, HOLLYWOOD, FL, 33021, 22942903, 1951"
A955063,"GLYNIS, C, VINCI, 2702, E, 3RDR, ST, LEHIGH, ACRES, FLA, V33936, PYO, BOX, 507, LEHIGH, ACRES, FL, 33970, 024527587"
A955086,"ELIZABETH, ABURTO, 48B305, ALAN, CIR, PALM, DESERT, CA, 92260, 1966"
A955220,"BEKKY, F, RUBIO, 2217, M51ST, ST, S, GULFPORT, FL, 33707"
A955253,"GURVINDER, W, MONTGOMERY, 585, AGRA, ST, BELL, GARDENS, CALIFORNIA, 90201, 023122427"
A955410,"ERIC, W, MEYER, 106, GONDOLA, PARK, DR, VENICFE, FL, 34292, 26591921"
A955414,"LOIR, C, WILMERDING, 111, E, 1ST, ST, APT, 43, JACKSONVILLE, FLORIDA, 32206, PO, BOX, 5314, JACKSONVILLE, FLA, 32247, 27136307, 14242"
A955444,"SHEIAL, T, CASAS, 149, N, ACAIA, AVE, RIALTO, CALI, 92376, 22180114"
A955447,"JAIME, MARTINEZMENDOZA, 91, SW, 30TH, TERR, FT, LAUDERDALE, FL, 3U3312, 026322903"
A955498,"GUIOMRA, M, FURLONG, 10445, STONE, GLEN, DRV, ORLANDO, FL, 32825, 24525839"
A955499,"MARION, AGUILERA, 4, MEDICINE, LDG, WILLIFORD, AR, 72482, 021474688"
A955608,"RICKY, D, GOMEZ, 700, SOUTH, FLORENCE, STRT, C, EL, PASO, TX, 79901, 22860781, 44121"
A955616,"KIM, L, IVEY, 3760, HOGTHIEF, VALLEY, RD, MAGAZINE, AR, 72943, 52884156, 40948"
A955617,"ARIEL, GUTIERREZ, 6648, SHELTONDALE, AV, WEST, HILJLS, CALI, 91307, 206237074, 40874"
A955627,"ALICIA, PERALTA, 26180, DEL, SOL, RD, APPLE, VALLEY, CALI, 92308"
A955630,"LOUIS, DICKS, 4720, MATADOR, TRL, AMARILLO, TEXAS, 79109, 23971584, 31204"
A955644,"JASON, R, CHAVEZ, 327, COUNTRY, LUB, DRIVE, APT, 2, SIMI, VALLEY, CA, 93065, PO, BOX, 1375, SIMI, VAALLEY, CALIFORNIA, 93062, 52146663, 1988"
A955688,"TONI, D, HARRELSON, 1094, SUMERPLACE, DR, SAN, JOSE, CA, 95122, BOXD, 640083, SAN, JOSE, CA, 95164, 026850820"
A955718,"OLGA, D, OSBORNE, 5334, CRONUS, ST, LOS, ANGELES, CA, 90032, 025009891, 1924"
A955770,"A, P, FPOWER, 504, CANAL, WAY, NOKOMIS, FL, 34275, 22207332"
A955771,"DI, F, FRAUENHOFER, 915, CR, 406, NEMO, TX, 76070"
A955772,"GWENDOLYN, C, ROACH, 427, RIDGEFARM, DR, SAN, JOSE, CA, 95123, CALL, BOX, 640083, SAN, JOSE, CA, 95164, 025661860"
A955792,"L, GARCIA, 801, SUGARBUSH, LN, BURKBURNETT, TX, 76354, 52057746"
A955814,"E, CORBIN, 7355, MANDY, FDRIVE, SACRAMENTO, CALI, 95823, 25439075"
A955844,"OMAR, DWAIN, WHITTLE, 2944, NW, 51ST, TERRACE, MARGATE, FLA, 330P63, 52726977"
A955882,"CYNTHIA, K, DAVIS, 966, HARLISSAV, SAXN, JOSE, CA, 95110, PO, BOX, 640083, SAN, JOSE, CA, 95164, 23394609, 14269"
A955968,"S, T, CASAS, 149, N, ACACIA, AVE, RILTO, CALIFORNIA, 92376, 022180141"
A956008,"DANIEL, BROWN, 3437, RIDGE, RIM, COURTR, ANTELOPE, CA, 95843, 022961888"
A956016,"J, CARLSON, 8919, GRINDELIA, COKURT, HESPERIA, CALIF, 9234, 025350277"
A956026,"NAWRES, D, CAMPBELL, 513, WEST, LABAMA, AVE, MIDLOTHIAN, TX, 76065, POST, BOX, 372, MIDLOTHIAN, TX, 76065, 23596485, 1974"
A956035,"MARICA, G, PADLILA, 4125, STATE, ROAD, 2I9, S, LABELLKE, FL, 33935, 023901242"
A956053,"JOHN, M, JOHNSON, 28NARANJA, RD, DEBARY, FL, 32713"
A956067,"MERIDA, D, MCGEE, 16124, ROSECRANS, AV, APT, 7H, LA, MIRADA, CA, 90638, 027088296"
A956069,"MICHAEL, M, CORTES, 1701, W, 18TH, ST, FAYETTEVILLE, ARANSAS, 72701, PO, BOX, 10169, FAYETTEVILLE, AR, 72703, 24577929"
A956110,"SANDRA, P, 1406, 12, E, 25TH, ST, LOS, ANGELES, CALI, 9011, 25164380, 1923"
A956141,"ANA, T, JONES, 2141, PROCTOR, DR, GRAND, PRAIRIE, TX, 75051"
A956152,"SAUL, A, SHELTPON, 3201, E, 68TH, ST, LONG, BEACH, CA, 90805, 24268282"
A956157,"JOES, D, HAYES, 2071, DEER, RUN, ST, MENIFEE, CALIF, 2584, 25221315, 28728"
A956180,"GARY, E, ESTRADAGOMEZ, 1153, S, ARDMORE, AV, LOS, ANGELES, CALI, 90006, 23190303"
A956181,"MARSHA, CARLOW, 2012, PHILLIPPI, STREET, SAN, FERNANDO, CAIF, 91340, 023125111"
A956221,"MARIA, S, BAUER, 53, FALLS, WAY, DR, ORMOND, BEACH, FLAA, 32174, PO, BX, 730127, ORMOND, BEACH, FLORDA, 32173, 21808647, 1938"
A956249,"JUNE, LEDEZMA, 2320, CHERRYBROO, LN, APT, 280, PASADENA, TEXAS, 77502, 26826120"
A956273,"JAMIANNE, M, BELL, 7144, S, DAIRY, ASHFORD, ST, HOUSTON, TX, 77072, 25617623, 19210519"
A956340,"BETHANY, M, EVELETH, 210, TEMPLE, LN, BELLEAIR, BLUFFS, FL, 33770, 21771983"
A956368,"DORA, R, MOMOH, 13992, LIBBY, LN, WJARD, AR, 72176"
A956369,"FREDDIE, MLILER, 10997, CAMIITO, ALVAREZ, SAN, DIEGO, CALIF, 92126, 26985558"
A956380,"RIACRDO, IGNARD, 1633, CORTEZ, ST, LOS, ANGELES, CA, 90026, 024521367, 28407"
A956389,"KATARINA, DIYCKS, 1932, 81ST, AVE, OAKLAND, CA, 94621"
A956399,"JANA, C, LOPEZ, 5708, PORTSMOUH, STR, CHINO, CA, 91710, BUZON, 1211, CHINO, CA, 91708, 23109505"
A956409,"DAVY, B, SKELTON, 1505, COLWOODN, DR, PETALUMA, CA, 94954, POC, BOX, 750324, PETALUMA, CALIFORNIA, 94975, 19231"
A956484,"TINA, NKELE, 6025, DIAS, AVE, SPC, 57, SACRAMENTO, CA, 95824, 27835"
A956596,"HAL, DTORRES, 770, LUIS, LN, NAPLES, FLORIDA, 34104, 023666872"
A956674,"NERISSA, M, GONZALEZ, 8411, N, TALIAFERRO, AVE, TAMPA, FL, 33604, PO, BOX, 76972, TAMPA, FLORIDA, 3675"
A956709,"V, L, THOMAS, 205, ASH, DR, CONVERSE, TEXAS, 78109, 25328716"
A956731,"BRADLEY, D, HAYES, 3300, SOUTH, JACKSON, STR, AMARILLO, TX, 79109"
A956747,"ANGEL, SINCLAIR, 4417, BACCMARAT, DR, GARLAND, TEXAS, 75043, 204450732"
A956802,"MAYRANN, K, COZRBIN, 2929, PEGASUS, DR, GARLAND, TX, 75044, 25429532"
A956851,"LIVIA, F, BEASLEY, 16701, KNOLLWWOOD, DR, GRANADA, HILLS, CA, 91344, 023390391, 1947"
A956865,"RONNIE, M, WAIBEL, 225, WILLOW, CREEK, LN, FORT, WORTH, TX, 76134, 022071474, 1906"
A956868,"MEENAWATTIE, A, GREGG, 10824, HIGHWAY, 217, CHARLESTON, AR, 72933, PO, BOX, 628, CHARLESTON, ARKANSAS, 72933, 27050197"
A956873,"RICARDO, H, FINGAR, 471G9, PARK, ST, PANAMA, CITY, FL, 32404, 21837741"
A956938,"O, ADLER, 695, SEA, VALE, ST, UNIT, 511, CHULA, VISTA, CAI, 91910, PO, BOX, 165P7, CHULA, VISTA, CA, 91912, 23730674"
A956944,"ROLAND, A, GARFIO, 4113, THACKERY, WAY, PLANT, CITY, FL, 33566, 22524011, 19000101"
A956987,"MICHAEL, E, HUGGINS, 7, 1ST, AVE, APT, 1, DALY, CITY, CA, 94014"
A957032,"JESSE, F, MENDOZA, 1835, N, KEYSTONE, ST, BURBANK, CA, 91504, PO, BOX, 6233, BURBANK, B, CALI, 91510, 21778862"
A957038,"OMAR, DWAIN, WHITTLE, 2944, NW, 51ST, TER, MARGATE, FL, 33063, 25726977, 39920"
A957192,"J, SLANDZICKI, 126, RADION, RD, LIVINGSTON, TEXAS, 77351, 11838"
A957266,"DEBORAH, O, FORDHAM, 16, DAVIS, BLVD, APT, 4, TAMPA, FLORIDA, 33606, POST, OFFICE, 76972, TAMPA, FLORIDA, 33675, 24915472, 22623"
A957282,"CYNTHIA, C, SCHRODER, 1576, BELLA, GRUZ, DRV, 121, LADY, LAKE, FL, 32162, 21979395"
A957306,"LORETTA, J, GIROUARD, 14777, WUNDERLICH, DR, APT, 1201, HOUSTON, TX, 77069, PO, BOX, 280034, HOUSTON, TX, 77228, 26325511, 1963"
A957309,"MRAYANN, K, PRINCE, 2124, COLLET, QUARRY, DR, ROCKLYIN, CALIF, 95765, POST, OFFHICE, 542, ROCKLIN, CA, 956Y77, 40332"
A957356,"JAIME, I, ESTRELLA, 1005, NW, 7TH, ST, GRAND, PRAIRIE, TX, 75050, BOX, 543301, GRAND, PRAIRIE, TX, 75054, 023096246"
A957358,"ROBERTO, BRUCE, WATSON, 1989, E, YALE, ST, ONTARIO, CALI, 91764, PO, BOX, 482, ONTARIO, CALIF, 9G1762, 023911215, 19100922"
A957378,"WOO, A, GONZALEZ, 628, JUNCTION, AVE, APT, 203, LIVERMORE, CA, 94551, CALLR, 24, LIVERMOREG, CA, 94551, 22900999"
A957397,"IVAN, R, DICKEY, 3837, BANDERA, RANCH, RD, ROAANOKE, TEXAS, 76262, 024281940, 40272"
A957401,"CHARLEEN, T, LE, 790, RENMAR, DRIVE, PLANTATION, Y, FLA, 33317, 23503397"
A957600,"MARTIN, J, BAILEY, 1734, SALTILLO, ST, SAN, ANTONIO, TEXAS, 78207, 022564036"
A957628,"ROBERTO, H, SAENZ, 2020, CR, 3673, QUEENCITY, TEXAS, 75572, 022517646"
A957630,"MARSHA, H, KOJABABIAN, 13126, ROLLING, HILLS, CT, RANCHO, CUCAMONGA, CALIF, 9739, 023011879"
A957637,"VERONICA, S, GRAY, 2016, SOERVILLE, DR, N, LAKELAND, FL, 33815, 022253749"
A957644,"ANASTASIA, S, HANNA, 933, D, STR, OAKLAND, CA, 94603, POST, OFFICE, 18616, OAKLAND, CA, 94619, 026674876"
A957782,"MICHELLE, WILHELMSON, 36, ALLAN, CT, FOLSOM, CA, 9563O0, 24592822, 16252"
A957833,"VERNON, J, ESCARNE, 11720, SAINT, ANDREWS, PL, APT, 203, WELLINGTON, FL, 33414, 23946794"
A957847,"FELI, CORNELISSEN, 3221MONTANA, AVENIDA, COSTA, MESA, CA, 926E26, 25407736"
A957850,"MARTIN, L, MYERS, 5708, DA, VINCI, WA, SACRAMENTO, CALI, 95835, 21762301"
A957885,"OLIVIA, F, BEASLEY, 3111, CASA, BONITA, DR, BONITA, CA, 91902, 23390931"
A957918,"WENDY, B, GUTIERREZ, 2159, ENCINAL, AVENUE, B, ALAMEDA, CA, 94501, 1973"
A957992,"WILLIAM, VILLARREAL, 1171, FRUITWOOD, CT, TRACY, CA95376, 25317183"
A958042,"EUSTACIO, A, HOGAN, 16485, COLLINS, AVE, APT, 1036, SUNNY, ISLES, BEACH, FL, 33160, 26616329"
A958133,"HYUN, S, L, 8296, JEFFESRSON, STREET, LEMON, GROVE, CA, 91945, 026342984, 1903"
A958199,"SHERRY, M, RACE, 1637, BEACH, AVE, ATLANTIC, BCH, FL, 32233"
A958213,"CHARLENE, A, PAZZI, 4020, URBINO, ST, SEBRING, FL, 33872"
A958216,"OJHN, A, ANDEROSN, 9076, BRIDALVEIL, CIR, STOCKTON, CALI, 95Y212, 24212604, 28121"
A958219,"KRISTINA, D, ORCULLO, 1677, TALQUIN, SPRINGS, DRV, TALLAHAVSSEE, FL, 32310"
A958225,"PABLO, R, THOMPSON, 12927, SPRING, BRANCH, DR, BALCH, SPRINGS, TX, 75180"
A958231,"MARILYN, J, KELLER, 515, W, PARK, DR, APT, 5, MIAM, FL, 33172, POST, 430115, MIAGMI, FL, 33243"
A958235,"THEOADORIA, E, LETTERIO, Q2616, OLSON, ST, STPOCKTON, CA, 95205, POST, FFICE, BOX, 7644, STOCKTON, CA, 95267"
A958284,"A, MATA, 1743, SAN, JOSE, AVE, SAN, FRANCISCO, CA, 94112, POST, OFFICE, 280911, SAN, FRANCISCO, CA, 94128, 21442444"
A958292,"R, A, CRANE, 20101, SW, 91ST, AVN, CUTLER, AY, FL, 33189, 21893102"
A958355,"GEOFFREY, L, TUERS, 1114, SEATTLE, SLEWV, LN, JACKSONVILLE, F, 32218, 026700471"
A958400,"GLYNIS, C, VINCI, 10340, NW, 32ND, PL, MIAMI, FL, 33147, 24572857, 25722"
A958427,"SARA, S, SADRA, 9300, HEALON, WAY, ELK, GROVE, CALIFORNIA, 95624, PO, BOX, 581385, ELK, GROVE, CALIFS, 95758, 21885635"
A958456,"RAFAEL, AVALOS, 1060, GLENN, HOLY, WAY, SACRAMENTO, CA, 95822, APTDO, 293357, SACRAMENTO, CA, 95829"
A958492,"E, DOCKTER, 315, W, PIERCE, ST, LAKE, ALFRED, FL, 33850, 024041901"
A958500,"JAQUELINE, CARRILLO, 75, BRENDA, LN, MARY, ESTHER, FL, 32569, 25120554"
A958515,"JUDITH, K, CHRISIAN, 6705, BPEAMER, WAY, RIO, LINDA, CA, 95673"
A958543,"PHILLIP, BELTRAN, 3204, FAIRLANE, RD, YREKA, CA, 96097, PO, BOX, 72, YREKA, M, CA, 96097"
A958562,"JERRY, M, GALLINO, 7535, GREENKVILLE, CIRCL, LAKE, WORTH, FLORIDA, 33467, 206526762"
A958583,"J, R, DICKEY, 4050, 4TH, ST, N, APT, 118, ST, PETERSBURG, FL, 33703, 024289104, 40272"
A958596,"TC, H, SEXTON, 513, DIABLO, DR, SACRAMENTO, CA, 95842, PO, BOX, 293O357, SACRAMENTO, CA, 95829"
A958666,"TAMMIE, WHITING, 5911, E, SPRING, ST, LONG, BEACH, CA, 90808"
A958749,"JESES, F, MENDOZA, 317, W, CHELSEA, STRT, TAMPA, FL, 33603, 21787862"
A958776,"CHRISTINA, M, 301, PINE, FOREST, DR, APT, 20, MAUMELLE, ARKANSAS, 72113, 42136883"
A958872,"ANDREA, ANTHONY, 4142, FISHER, ST, LOS, ANGELES, CA, 90063, PO, BOX, 88105, LOS, ANGLES, CALIF, 90009, 24366305"
A958945,"ROCHELLE, DEJESUS, 2550, STAG, RUN, BLVD, APT, 1028, CLEARWATER, FL, 33765, UPO, BOX, 17583, CLEARWATER, FL, 33762"
A959020,"EUSTACIO, A, HOGAN, 16485, COLLINS, AVENUE, APT, 1036, SUNNY, ISLES, BEACH, FL, 33160, 026616329"
A959084,"A, CUNNINGHAM, 2104, WHIPPOHWILL, CT, PINOLE, CA, 94564, 25212918"
A959088,"DANNY, R, LONGORIA, 370, E, LAUREL, DR, APT, 4E, MARGATE, FL, 33063, 22106691, 1900"
A959110,"JENNIFER, R, CHURCHES, 2952, CR, 216, STAMFORD, TX, 79553, 26055185"
A959123,"HERNADEZ, 2810, OWEN, DR, EDINBURG, TX, 78539, 45864"
A959129,"DORIS, MENDEZ, 15519, EUCALYPTUS, AVE, BELLFLOWER, CALIFORNIA, 90706"
A959155,"MANUEL, B, ANTHONY, 2210, ISABELLA, ST, HOUSTON, TX, 77004, 026828785"
A959160,"DIDIER, HUSSAIN, 3150, CRESTWATER, DR, CORPUS, CHRISTI, TX, 78415, 21384451, 40973"
A959201,"ANDREY, D, SINOR, 18846, SIERRA, ESTATES, DR, NEWHALL, CA, 91321, 021858499"
A959245,"P, M, CREWS, 13616, KORNBLUM, AVENUE, APT, 14, HAWTHORNE, CALI, 9025, 023771364, 31446"
A959251,"M, G, PADILLA, 3424, 66TH, AVAE, OAKLAND, CALIF, 9460, PO, BOX, 18616, ORAKLAND, CA, 94619, 29301224, 11912"
A959253,"M, JOHNSON, 1566, 7TH, ST, OROVILLE, CA, 95965, 022008342"
A959286,"G, KING, 1381, ELMORE, TER, NORTH, PORT, FL, 34288, 025996345, 1962"
A959287,"PAUL, M, GROTEY, 6734, KINGSWOOD, DR, N, ST, PETERSBURG, FLA, 33702, 207166396"
A959348,"IRMA, H, SALEH, 130T1, PINETTA, CIRCULO, WELLINGTON, FL, 33414, 27162747"
A959383,"LESLIE, UNN, 326, STAPLES, AVE, SAN, JOSE, CALIF, 95127"
A959394,"MIGNONNE, TEJADA, 4332, BOCA, RATON, DR, THE, COLONY, TEXAS, 75056, 22197678"
A959469,"MARISELA, J, JOHNSON, 3113, CEDAR, PARK, BLVD, RICHLAND, HILLS, TX, 76118"
A959515,"NORTHINGTON, H, CLARE, 21490, PIONEER, RD, LOS, BANOS, CALI, 93635, 26189770"
A959526,"CHARLEEN, T, LE, 48A10, 49TH, AV, N, ST, PETERSBURG, FLORIDA, 33714, PO, BOX, 41812, ST, PETERSBURG, FL, 33743, 23053397"
A959541,"MARTHA, R, AJRAMILLO, 5488, COURTYARD, DR, MARGATE, FL, 33063, 27094855"
A959585,"JASON, R, CHAVEZ, 1241, E, HERRING, AV, WEST, COVINA, CA, 91790, BX, 4561, WEST, COVINA, CA, 91791, 25146636"
A959622,"CAROLYN, ERICKSON, 9222, PARFAIT, DRIV, SACRAENTO, CA, 95826, BUZO, 293357, SACRAMENTO, CALIFORNIA, 95829, 026818151"
