refID,tokens
A904697,"A, GARFIO, 1305, NORTH, FOYD, STR, LOT, 10, JONESBORO, Y, AR, 72401, 22542011"
A904735,"JOHN, A, ANDERSNO, 9076, BRIDALVEIL, CIR, STOCKTON, CA, 95212"
A904739,"L, LANTRIP, 6417, KENNEDY, CT, WATAUGA, TX, 76148O, 25579615, 45372"
A904758,"JOYEC, M, PALLETT, 1857, W, 24TH, ST, APT, 1, LOS, ANGELES, CA, 90018, 012687271, 1961"
A904811,"MARAI, J, LOPEZ, 40850, CORTE, LBOS, REYES, INDIO, CA, 92203, 25213528"
A904838,"ALBERTO, MALKIEWICZ, 1124, SOUTHWEST, 2ND, AV, POMPANO, BEACH, FLORIDA, 3306E0, 27111743, 20999"
A904861,"J, D, ANTHONY, 2320, JARDIN, DR, OXNARD, CASLI, 93036, 24370640"
A904877,"RODNEY, M, BRACKLE, 1559, ROCDKWOOD, STRT, LOS, ANGELES, CA, 90026, PO, BOX, 881605, LOS, ANGELES, CA, 90009, 22345095"
A904913,"J, C, WHITE, 235, HEMPSTEAD, 125, HOP, AR, 71801, 021258240, 20398"
A905010,"HOPE, Z, COOLING, 2731, ERS, LANE, MISSOURI, CITY, TEXAS, 77459, 026125060, 37882"
A905041,"CARLDREK, M, CHAVEZ, 16060, SW, INDIANWOOD, CIR, INDIANTOWN, FL, 34956, PO, BOX, 2051, INDIANTOWN, FL, 34956, 023285418"
A905153,"CRUZ, S, 3660, N, 56TH, AVE, APT604, HOLLYWOOD, FL, 33021, PO, BOX, 817432, HOLLYWOOD, FL, 33081, 22075433, 38106"
A905307,"ANASTACIO, J, WALSH, 1050, ILSHIRE, BOULV, APT, 210, LOS, ANGELE, CA, 90017, BUZON, 881605, LOS, ANGELES, CA, 90009, 27047559"
A905320,"HOPE, Z, COOLING, 14325, CEDAR, POOST, DR, HASLET, TEXAS, 76052, 26125006, 37882"
A905465,"SHAID, MARTINEZRUIZ, 11029, VANESSA, AVE, ENGLEWOOD, FL, 34224, 024770844, 1929"
A905488,"NILESH, F, MCKELVEY, 529, DANIELS, ST, WOODLAND, CA, 95695, 024714029"
A905547,"DUANE, VALENTINE, 2000, CLUB, VIEW, CIR, CORINTH, TEXAS, 76210, 23312087, 1935"
A905562,"CHRISTINA, ROJAS, 1730, S, CONLON, AVE, WEST, CVINA, CA, 91790, 24136883"
A905577,"GLEN, K, JANISCH, 5204, SWAPS, CT, BAKERSFIELD, CALIF, 93312, PO, BOX, 60103, BAKERSFIELD, CA, 93386, 28559531, 1949"
A905600,"MICHAEL, L, WYNN, 210G6, PINETREE, CT, RANCHO, CORDOVA, CA, 95670, 021777345, 39159"
A905663,"ALICHA, K, SNEED, 7485, WREN, AVE, GILROY, CA, 95020, 024047556"
A905693,"MELONY, R, GREGORY, 3731, ROCKY, WOODS, DRJ, KINGWOOD, TX, 77339, 26394931, 1930"
A905748,"CHRISTINE, M, BROWN, 14092, POLLARD, DRI, LYTLE, CREEK, CA, 92358, 23805088"
A905773,"M, FRESE, 7724, PARKLAND, DRV, EL, PASO, TX, 79925, POST, BOX, 27096, EL, PASO, TX, 79926"
A905796,"MARISELA, J, JOHNSON, 2350, KENDAL, GREEN, JCIRC, COLLEGE, TATION, TEXAS, 77845, 26432468"
A905817,"GRISEL, J, GAPOL, 1124, WESTACRE, ROAD, WEST, SACRAMENTO, CA, 95691, 023605107, 40739"
A905823,"JOHN, R, DICKEY, 712LAKE, GROVE, DR, LITTLE, ELM, TX, 75068, 24281904"
A905844,"CHARLES, BRYAN, WARD, 4142, FISHER, STRET, LOS, ANGELES, CA, 90063, 25186772"
A905951,"ISMENIA, H, MOONEY, 1302, LO, MAR, ST, BENTONVILLE, AR, 72712, PO, OX, 2223, BENTONVILLE, AR, 72712, 24895922"
A905966,"JESSICA, JIMENEZ, 2041, N, WINERY, AVE, APT, 104, FRESNO, CA, 93703, BUZON, 5991, FRESNO, CA, 93755"
A905978,"JUAN, M, FERREIAR, 6108, SPRINGLEAF, CIR, FORT, WORTH, TEXA, 76133, 22157858"
A905986,"HSAWNTHA, STONE, 7344, MONTERREY, DR, FORT, WORTH, TX, 76112, 028631963, 1936"
A906014,"MICHAEL, M, CORTES, 4332, KRAG, ST, EL, PASO, TX, 79938, 24757929"
A906079,"VICTORIA, L, THOMAS, 1915, ILLINOIS, ST, VALLEJO, G, CA, 94590, OFFICE, BOX, 5745, VALLEJO, CA, 94591"
A906150,"GRISEL, J, J, 10332, BEAR, CREEK, TRL, KELLER, TEXAS, 76248, 23605071"
A906172,"TORY, L, THOMAS, 1515, WEBSTER, ST, SAN, ANGELO, TX, 76901"
A906178,"MRATIN, J, BAILEY, 238, CONNIE, ST, OUSTON, TX, 77076, 22564036, 25223"
A906194,"WON, R, DENHART, 1712, E, PINE, AVE, EL, SEGUNDO, CA, 90245, 026806788, 1959"
A906197,"JOSE, SAMMARRO, 9600, GOLF, LAKES, TRL, APT, 1144, DALLAS, TX, 75231, 25667"
A906202,"E, GARCIA, 7360, NW, 18TH, ST, 37107, MARGATE, FL, 33063, 022886056"
A906213,"KARLA, S, LOR, 395, APRICOT, ST, NIPOMO, CALIFORNIA, 93444"
A906267,"I, P, B, 7626, RIMHURST, SAN, ANTONIO, TX, 78250, 24230419"
A906293,"NILESH, F, MCKELVEY, 30204, VIA, AMANTE, MENIFEE, CA, 92584, 27414029"
A906321,"RANDALL, M, HERNANDEZ, 6915, DRY, CREEK, RD, RIO, LINDA, CA, 95673, 25930462"
A906338,"JO, N, BOSCH, 215, BEACON, WAY, SANTA, ROSA, BEACH, FL, 32459, PO, BOX, 1319, SANTA, ROSA, BEACH, FL, 32O459"
A906347,"PAUL, M, G, 6734, KINGSOOD, DR, N, ST, PETERSBURG, FL, 33702, 27166396"
A906362,"GLADYS, HAYSE, 4329, SUMMER, STAR, N, KELLER, TX, 7248, 21582249, 1902"
A906433,"HELIO, E, IVERA, 401, WLKER, ST, ARVIN, CAIFORNIA, 93203, 1951"
A906565,"JUNE, LEDEZMA, 5118, 31ST, AVE, S, APT, 1, GULFPORT, FL, 33707"
A906578,"WILMA, VILLARREAL, 7500, IRA, AVE, BELL, GARDENS, CA, 90201, 25317183, 1903"
A906634,"JO, N, BOSCH, 1800, SE, 18KTH, TER, HOMESTEAD, FL, 33035, 206193626"
A906733,"ELIZABETH, E, J, 3825, LITTLE, ROCK, DRV, APT, 96, ANTELOPE, CA, 95843, 026808105"
A906816,"D, RUANO, 32, SLOWCUM, PATHS, PALM, COAST, FL, 32164, 24706276, 13830"
A906820,"YSELA, SAIZ, 12056, TERRA, CIRC, FOREY, TEXAS, 75126, PO, BOX, 21, FORNEY, TX, 75126, 023887230"
A906829,"BETHANY, M, EVELETH, 209, DEL, TORO, DRIV, LADY, LAKE, FL, 32159, PO, BOX, 1615, LADY, LAKE, FL, 32158, 21771983"
A906845,"PAUL, I, HORACE, 2790, CIBOLA, AV, COSTA, MESA, CALIFORNIA, 9626, 24794774"
A906864,"KYLE, M, LEWIS, 1604, CALLE, DEL, PASE, IRWINDALE, CA, 91706, 024750609"
A906879,"RICK, E, HENSLEY, 11819, CENTRAL, AVE, APT, T308, CHNO, CA, 91710, 204471256"
A906900,"MARIA, L, DAVIDSO, 9708, WALNUT, STP, OAKLAND, CALI, 94603, 15723"
A906926,"BRENDA, B, KRIEGER, 16044, DEVONSHIRE, ST, GRANADA, HILLS, CA, N91344, 24348689"
A906940,"CNOCEPCION, A, SORIANO, 121, ESKOTAST, MABANK, TX, 75156, 26119889"
A906942,"CYNTHIA, C, S, 401, N, HARBOR, LIGHTS, DR, PONTE, VEDRA, FL, 32081, 201979395"
A907042,"RICARDO, S, JACKSON, 1387, FOUR, SEASONS, BOULEVARD, 89, TAMPA, FL, 33613, 023256707"
A907131,"KEVIN, A, TAYLOR, 255, WALKER, STR, CENTER, TX, 75935, 24073506, 1920"
A907164,"S, F, KOBZEFF, 653, S, ESPLANADE, ST, ORANGE, CALI, 92869, 025560419"
A907235,"JESSE, A, JONES, 1915, CR, 406, NEMO, TX, 76070, 62916805"
A907237,"TORY, L, THOMAS, 1515, WEBSTER, ST, SAN, ANGELO, TEXAS, 76901, 25328176"
A907249,"SUSNA, T, JACBOSON, 1214, QUAIL, CIR, CEDAR, PARK, TEXAS, 78613, 022154708, 11794"
A907263,"ABMER, W, PRENTICE, 370, W, 6TH, ST, PERRIS, CA, 92570, 24963381"
A907284,"JAMIANNE, M, BELL, 652M9, PUTTING, GREEN, DR, DALLAS, TX75232, 25617623"
A907296,"DONNA, S, TOBA, 91, DEMPSEY, RD, MILPITHAS, CA, 95035, PO, BOX, 360338, MILPITAS, CA, 9506, 024567354"
A907336,"P, V, FLOERS, 9738, HELEN, AVE, SUNLAND, CALIF, 91040P, 25400116"
A907355,"BRENDA, B, KRIEGER, 1256, 3RD, AVE, APT, 18, CHULA, VISTA, CA, 1911, 024384689"
A907384,"VONNIE, S, GRAY, 2830, SAN, DIEGO, PLZ, JACKSONVILLE, FL, 32207, PO, BOXY, 5314, JACKSONVILLE, FLA, 32247, 22253749, 1976"
A907424,"ELLEN, C, ROBERTS, 1917, RODNEY, DR, APT, 212, LOS, AGELES, CA, 90027, POST, OFFICE, BOX, 881605, LOS, ANGELES, CA, 90009, 022076398"
A907499,"ASLHEY, S, W, 7729, ASHFORD, CT, N, SAINT, PETERSBURG, FLA, 33709, PO, BOX, 15632, SAINT, PETERSBUROG, FLA, 33733, 023141981"
A907505,"BARBARA, A, COOK, 1717, ORIOLE, STR, SAN, DIEGO, CA, 92114"
A907561,"JESSICA, A, JONES, 7019, WINNETKAAV, WINNETKA, CA, 91306"
A907641,"LEENA, VANDYKE, 830, S, AZUSA, AVEN, TRLR, 10, AZFUSA, CALIF, 91702, 24648691"
A907656,"THOMAS, L, POUNDIS, 1276, WAVERTON, LN, LINCOLN, CA, 95648"
A907671,"WILMA, G, PUNO, 2130, W, CRESCENT, AVE, APT, 1098, ANAHEIM, CALIF, 92801, 022588987"
A907771,"PATRICIA, J, THAYER, 44348, 42ND, ST, W, LANCASTER, CA, 93536, 22603777"
A907782,"RICARDO, N, ROBERTS, 1601, REGENT, DRIV, BRENTWOOD, CALIFORNIA, 94513, PO, BOX, 1690, BRENTWOOD, CA, 94513"
A907840,"JASON, FLORSE, 3039, PINE, VALLEY, RD, SAN, RAMON, CALI, 94583, OBUZON, 2606, SAN, RAMON, CA, 94583"
A907898,"AMBER, W, PRENTICE, 1282, MATTOX, RD, APT, 45, HAYWARD, CA, 94541, PST, 55582, HAYWARD, CALIF, 94545"
A908026,"LAURYN, L, SINCLAIR, 1640, SOPHIEP, LANE, ESCADLON, CA, 95320, 024447556"
A908041,"J, W, KINDELL, 45761, CAMINO, BRUBI, TEMECULA, CA, 92592, 202810696"
A908180,"MACARIO, C, CRUZ, 95A10, HARVARD, STREET, BELLFLOWER, CA, 90706, PO, BOX, 1100, BELLFLOWER, CALIFORNIA, 90707, 23072005"
A908205,"GINA, D, RUSSELL, 3605, HIGHWAY, 90T, W, POCAHONTAS, ARKAN, 72455, PO, BOX, 674, POCAHONAS, ARKANSAS, 72455"
A908231,"JOSH, SLANDZICKI, 2207, WYNDAM, WAY, KISSIMMEE, FLORIDA, 34743, 022202042"
A908266,"E, B, C, 88K4, CORAL, REEF, WAY, PONTE, VEDRA, FL, 32082, 22431847"
A908280,"BRADNT, A, CALOV, 241, WEVER, TRAIL, JESSIEVILE, ARKANSAS, 71949"
A908334,"ANTHONY, A, MATRENS, 521, COCHRAN, AVEN, SAN, DIEGTO, CA, 92154, 202100234"
A908374,"ALBERTO, MALKIEWICZ, 6237, GRANT, ST, CHINO, CALIF, 91710, 027111734, 1957"
A908396,"FRED, S, F, 28164, HORIZON, CT, ROMOLAND, CA, 92585"
A908425,"TED, J, DICK, 2521, MLINO, RD, MOLINO, FL, 2577, 21402494"
A908429,"LEBEKA, D, WILLIASM, 1134, DODGE, AVE, OROVILLE, CA, 95965"
A908482,"LANH, K, HART, 12L394, PASEO, CORTO, CIR, EL, PASO, TX, 79928, APTDO, 27096, EL, PASO, TX, 79926, 21609352"
A908528,"KADESHRA, R, GALLEGOS, 12603, WOODFOREST, BLVD, APT, 913, HOUSATON, TX, 77015, 24275742"
A908576,"ANASTASIA, J, BISHOP, 1521, N, WILTON, PL, APT, 6, LOS, ANGELES, CA, 90028, APARTADO, 881605, LOS, ANGELES, CALIF, 900D09, 28141"
A908627,"D, HARRELSON, 13230, NE, 34TH, TER, GAINESVILLE, FL, 32609, PO, BOX, 607, GAINESVILE, FLA, 32602"
A908642,"JASON, R, CHAVEZ, 2242, SW, IMPORT, DR, PORT, SAINT, LUCIE, FLA, 34953, 25146663"
A908643,"EDWADRO, B, CHRISTIAN, 884, CORAL, REEF, WY, PONTE, VEDRA, FL, 32082, 022431487"
A908653,"PATRICK, B, ARNOLD, 2049, SANTA, CRUZ, AVE, MVENLO, PARK, CA, 94025, 025409434, 40025"
A908662,"MELISSA, T, HICKS, 4346, HAMMEL, ST, LOS, ANGELEJS, CA, 90022, 24515296"
A908670,"ARMANDO, CANTLOW, 13340, MERCER, STREET, PACOIMA, CALIFORLNIA, 91331, 22382055, 1900"
A908704,"WILL, I, DAVIS, 20131, COLORADO, RD, EL, MIRAGE, CALIF, 92301, 026623839"
A908732,"WILMA, M, GILLIAM, 340, NORTHWEST, 48TH, AV, APT, 511, LAUDERDALE, LAKES, FL, 33319, 23828662"
A908757,"TONY, C, MCNEILL, 4021, BANCROFT, DR, HOLIDAY, FL, 34691, 26474810"
A908818,"KARLA, OLR, 19895, SILVERWOOD, DRMV, LAKE, ELSINORE, CALI, 92530, PO, BX, 1228, LAKE, ELSINORE, CA, 92531, 19440806"
A908835,"BRADY, T, MARES, 9896, BEN, NEVIS, BLVD, APT, 11, RIVERSIDE, CALIF, 9209, 24206"
A908884,"MARIA, K, KRAUS, 235, STARFIH, DR, VLLEJO, CA, 94591, 25759178"
A909014,"DAVID, W, JERDAN, 2028, IBAYOU, DR, NAVARRE, FL, 32566, 42774"
A909028,"GARY, E, ESTRADAGOMEZ, 15040, SILVERSMITHN, CRCLE, SPRING, HILL, KFLA, 34609, BOX3353, SPRING, HILL, FL, 34611, 15386"
A909129,"M, H, KOJABABIAN, 23136, GSAMUEL, STR, APT, 117, TORRANCE, CA, 90505, PO, BOXQ, 268, TORRANCE, SCA, 90507, 23011789"
A909151,"IRMA, H, SALEH, 7361, BOLTEN, LN, PORT, CHARLOTTE, FL, 33981, 27167247"
A909165,"L, BOMMARITO, 1123, SE, 5TH, AVE, ARCADIA, FL, 34266, PO, BOX, 3045, ARCADIA, FLA, 3265, 023215205, 11176"
A909177,"A, M, HARRISON, 4127, GLEASONST, LOS, ANGELES, CA, 90063"
A909194,"TOMMY, ARIZA, 20321, WSTPOINT, DRIVE, RIVERSIDE, CALI, 2507, 023789893"
A909199,"A, GOSSET, 9137, 85T, AVE, NO, LARGO, FL, 33777, 22015609"
A909202,"JANICE, M, WALTON, 6323, HEATHERS, BND, SA, ANTONIO, TEXAS, 78227, 202551375"
A909242,"BOBBY, BEN, FALL, 123, MIRABEAU, AVE, SAN, PEDRO, CA, 90732, 26841318, 1964"
A909295,"WILLIAM, VILLARREAL, 20681, XOLEANDER, AVENIDA, PERRIS, JCA, 92570, 25317183, 1903"
A909296,"ETHELE, L, MARBLE, 3773, RIPPLE, CREEK, DR, DALLA, TEXAS, 75224, PO, PBOX, 810892, DALLAS, STEXAS, 75381, 23031960"
A909316,"MARCUS, Y, TAO, 2001, BRINSON, RD, UNIT, 27, LUTZ, FLA, 3358, 26558839, 36526"
A909342,"NORTHINGTON, H, CLARKE, 3917, DEL, REY, DR, SAN, BERNARDINO, CA, 92404"
A909370,"ROSEMARY, F, PHILLIPP, 14625, S, CASTLEGATE, AVE, COMPTON, CA, 90221, OFFIE, BOX, 5124, COMPTN, CALI, 90224, 26206258"
A909466,"WILLIE, S, GILBERT, 3276, HIGHWAY, 160A, BONIFAY, WFL, 32425, 25385907"
A909471,"BRIAN, M, WRIGHT, 8555, KYLE, QSTREET, SUNLAND, CA, 91040, 021539204"
A909608,"G, RODRIGUEZ, 2301, NE, 35TH, ST, CAPE, CORAL, FL, 33909, 37309"
A909629,"JOES, E, TOFFT, 931, HILL, MEADOW, DRIV, MIDLOTHIAN, T, 76065, 27131114, 12966"
A909635,"LEBEKA, D, WILLIAMS, 1134, DODGE, AVE, OROVILLE, CA, 95965, 203920858, 26111"
A909663,"MARIAH, ZATARAIN, 2012, PHILLIPPI, STREET, SAN, FERNANDO, CA, 91340"
A909666,"FRANCISCO, WEAVER, 6590, ELMHURST, DRV, TUJUNGA, CALIF, 91042, PO, BOLX, 96, TUJUNGA, CA, 91043, 024149595"
A909680,"VALERIE, A, GUY, 7395, EDENFIELD, PARK, RD, JACKSONVILLE, FL, 32244, FFICE, BOX, 5314, JACKSONVILLE, FL, 32247, 26134977"
A909692,"ANNIE, JACKSON, 3979, LONG, GROVE, LN, PORT, ORANGE, FL, 321L29, YBOX, 1162, PORT, ORANGE, FL, 32129, 026474942, 13415"
A909768,"SONIA, G, DEGUZMAN, 3837, BANDERA, RANCH, RAD, ROANOKE, TX, 76262, 24279712"
A909854,"SANDRA, R, RALSTON, 1501, NE, 191KST, ST, APT, C305, NORTH, MIAMI, BEACH, FL, 33179, 25221415"
A909864,"ERNESTINE, NKELE, 130, CODY, CT, UPLAND, CALIF, 9178, PO, BX, 671, UPLAND, CA, 91785, 32963910"
A909873,"M, Y, KELLEY, 5178, NW, RUGBY, DR, PORT, SAINT, LUCIE, FL, 34983, PO, BOX, 8433, PORT, SAINT, LUCIE, FL, 34985, 26685998"
A909896,"JOSE, E, TOFFT, 931, HILL, MEADOW, DR, MIDLOTHIAN, TX, 76065, 27131114"
A909904,"JASON, C, GUY, 14057, LIVINGSTON, MDW, 22, GARDEN, GROVE, CALIF, 92844, 026152974"
A909924,"KANESHA, J, MORALES, 7260, N, FRUIT, AVNUE, FRESNO, A, 93711, BUZON, 5991, FRESNO, CA, 93755, 22063275"
A909927,"FRANCINE, J, HUSSPAIN, 14668, ILDWOOD, DRIVE, LARGO, FL, 33774, 21370191, 1915"
A909989,"FRANCISCO, FAKHOUR, 1226, NORTH, CREEKSIZDE, DRIV, CHULA, VISTA, CA, 91915, 23777136, 1980"
A909994,"STACY, J, BISHOP, 7044, MEADOWRDG, CORONA, CA, 92880, 203818812, 1977"
A910004,"IRENE, GARY, 12438, JASMINE, BROOK, LN, HOUSTON, TX, 77089, 24147180, 25581"
A910008,"ROBERT, D, MLAAE, 4465, NORMANDIE, PL, LA, MESA, CALI, 91941, 023817904, 1946"
A910025,"E, V, CRAIG, 1690, E, FIR, AVE, APT, 212, FRESNO, CA, 9720, 023184656"
A910059,"G, ELLIOTT, 802, E, DAVENPORT, ST, STAMFORD, D, TEXAS, 79553, 26817924"
A910060,"H, MADARANG, 14721, BONAIRE, BOUL, APT, 1A06, DELRAY, BEACH, FL, 33446, 23623638"
A910126,"JORGE, AMEREAN, 777, WALKERBILT, RD, LOT, 3, NAPLES, FL, 34110"
A910195,"M, G, HABTE, 5800, OWENSMOUTH, AVE, APT, 18, WOODLAND, HILLS, CA, 91367, 19267"
A910229,"JOSEPH, D, GONZALEZ, 10182, COUNTY, ROAD, 213, FORUNEY, TX, 75126, PO, BOX, 2, FORNEY, TEXAS, 75H126, 26523214"
A910240,"MARIAH, L, PEEK, 2107, WHEATFIELD, CIR, WILDOMAR, CA, 92595, 15723"
A910260,"CHARLENE, A, PAZZI, 2311, HICKORY, PINSE, STRT, ORLANDO, FLAS, 32817, 026070201, 1920"
A910303,"PATRICIA, J, MCCARTHY, 2020, CR, 3C673, QUEEN, CITY, TX, 75572, 22492433, 44058"
A910354,"MITCHELL, C, LOPEZCASTILLO, R2697, W, 73RD, PL, HIALEAH, FL, 33016, 25825325"
A910414,"MANNY, MULLIS, 111, E1ST, ST, APT, 43, JACKSONVILLE, FL, 32206, POST, OFFICE, 5E314, JACKSONVILLE, FLORIDA, 32247, 12203"
A910463,"JANA, C, LOPEZ, 4161, TIM, ST, BONITA, CALI, 91902, PO, BOX, 904, BOITA, CA, 91908, 023105905"
A910561,"WALTER, E, GARRISON, 6304, LAKE, PLANTATION, DR, JACKSONVILLE, FL, 32244, 21688429, 20697"
A910577,"CECILIA, GRERE, 12418, SCHOONER, BEACH, DRIVE, BAKERSFIELD, CA, 93311, 22524764"
A910604,"L, E, PADGETT, 248, SE, 45TH, ST, CAPE, CORAL, FL, 33904, 24645927, 1924"
A910692,"LORTETA, J, GIROUARD, 14150, HAYES, ST, VAN, NPUYS, CA, 91401, 26325511"
A910716,"M, SUGUIMIZU, 17703, WHEAT, FIELD, ST, LATHGROP, CA, 95330, 26984558"
A910769,"J, KEGLER, 2554, SOUTHWEST, 118TH, LN, BLDG, 21, MIRAMAR, FL, H33025, 021370119"
A910815,"GARY, E, ESTRADAGOMEZ, 627, LASSEN, CT, TULARE, CALIF, 93274, APTTDO, 1276, TULARE, CA, 93275"
A910852,"ROGRE, MADRID, 1147, RAINTWOOD, CIR, W, PALM, BEACH, GARDENS, FL, 33410, 023226182"
A910921,"LAURIE, L, SINCLAIR, 1640SOPHIE, LANE, ESCALON, A, 95320, 024447565"
A910936,"KEVIN, A, TAYOLR, 255WALKER, ST, CENTER, TEXAS, 75935, 024073506, 44045"
A910960,"MARINA, D, STEWIART, 109, TWILIGHT, BAY, DRIV, PANAMA, CITY, BEACH, FL, 32407, 022468936"
A910964,"TOMMY, ARIZA, 20321, WESTPOTINT, DRV, RIVERSIDE, A, 92507"
A911006,"DANE, S, DOZIER, 2301, TURNER, ROAD, CERES, CA, 95307, 42027258"
A911037,"STEVEN, J, ODOM, 2090, WELDON, LN, BAY, POINT, CA, 94565, 026390936"
A911113,"M, D, FREEMAN, 321, FORDHAM, AVE, BIG, SPRING, TX, 79720, 24867344"
A911120,"SHELLEY, S, RIHCARDS, 3307, SINDLETOP, CT, MANVEL, TX, 77578, 25996446"
A911153,"DAIVD, B, SKELTON, 61, LAUREL, AVE, SAN, ANSELMO, CA, 94960, 23138495, 19231"
A911166,"ELLIE, M, BELOTE, 4303, MASTERS, DR, LEAGUE, CITY, TX, 77573, 026487013"
A911180,"S, WARSING, 100, LEEMAR, PL, HOT, SPRINGS, NATIONAL, PARK, AR, 71901, 26109309"
A911202,"GREG, P, C, 238, 11TH, ST, RIVERSIDE, CA, 92507"
A911262,"IRMA, H, ASLEH, 1301K, PINETTA, CIRCULO, WELLINGTON, FL, 33414"
A911271,"NILESH, F, MCKELVEY, 1318, PORTSMOUTH, T, OAKLEY, CA, 9456W1, PO, BOX, 1P112, OAKLEY, CALIFORNIA, 94561, 14202"
A911306,"BARBARA, A, COLLINS, 1849, BAYWOOD, DR, APT, 05, CORONA, CA, 92881, PO, BOX, 77501, CORONA, CA, 92877, 23566960, 19700628"
A911354,"ELAINE, GARCIA, 7360, NW, 18TH, ST, 37107, MARGATE, FL, 33063"
A911367,"RANDAL, R, HALL, 5423, KLEBERG, DRV, GRAND, PRAIRIE, TX, 75052, CALLER, Y543301, GRAND, PRAIRIE, TX, 75054, 22267805"
A911368,"RUTH, D, MARTINEZ, 28936, OAK, HILL, LN, HIGHLAND, CA, 92346, 205542023"
A911385,"EDWARD, J, DICK, 2521, MOLINO, RD, MOLRINO, FLA, 32577, 21402494"
A911420,"RENEE, M, CATORA, 1827, XIMENO, AVENUE, 133, CLONG, BEACH, CA, 90815, 023347907"
A911473,"NANCY, E, CARPENTER, 21672, WINDAM, RUN, ESTEROX, FL, 33928, 027012011"
A911498,"TONY, A, MARTENS, 31532, VINTNERS, POINTE, CT, WINCHESTER, CA, 92596, 22100234"
A911504,"ANTHONY, HUERTA, 13551, SW, 256TH, ST, HOMESTEAD, FL, 33032, 024631642"
A911526,"JORGE, AMEREAN, 118, COLGATE, AVE, SANANTONIO, TX, 78228, POST, OFFICE, 690362, SAN, ANTONIO, TX, 78269, 22477845"
A911537,"RANDALL, M, HERNANDEZ, 25301, BOWIE, CT, STEVENSON, RANCH, CALI, 91381, 25930462"
A911548,"MARTHA, M, RAMIREZ, 6818, DORIANA, ST, APTV, 120, SAN, DIEGO, CA, 92139, 23665642"
A911612,"DENNIS, URANO, 29972, GRANGER, PL, CASTAIC, CA, 91384"
A911645,"OLAJIDE, GLODSTON, X2160, KELLY, ST, HAYWARD, CA, 94541, 029362132, 1936"
A911648,"ROBERT, BEN, FALL, 1693, RODEAR, RD, SAN, DIEGO, CALIFORNIA, 92154, 026841318"
A911662,"XUANDAO, ATIENZA, 1026, BIRCH, AV, WASCO, CA, 93280, 24611071"
A911688,"DANIEL, BROWN, 73265, ROD, LAVER, LN, PALM, DESERT, CA, 92260, 022961888"
A911730,"ROBERT, EMMITT, WOODARD, 17341, REDMAPLE, ST, FONTANA, CA, 92337, 21976174"
A911757,"BLANCA, ARTENSTEIN, 1004, KIMBRO, DR, FORNEY, TX, 75126"
A911772,"HELEN, C, ROBERTS, 23012, OXFORD, PL, BOCA, RATON, FL, 3333"
A911817,"MICHAEL, S, LAKNDOW, 1852, BANBRURY, RD, JACKSONVILLE, FLA, 32211, 22984160"
A911844,"CLARA, R, BROWN, 1823, RANCO, LOMAS, WY, SAN, MIGUEL, CA, 9341"
A911943,"M, CARLOW, 967, W, 4TH, ST, POMONA, CA, 91766, 41911"
A911959,"WENDY, B, WALTON, 10386, MILLS, TOWER, DR, RANCHO, CORDOVA, CA, 95670"
A911968,"ANDREW, D, ROBINSON, 4135, ANATOLIA, DRIVE, RANCHO, CORDOVA, CA, 95742, 203747388, 1949"
A911973,"F, REDDISH, 8440V, JORDAN, ST, SAN, QDIEGO, CA, 92123, 024508033"
A911988,"ELIZABETH, M, M, 3910, W, BEECHWOOD, AVE, APT, 133, FRESNOS, CALI, 93711, 25185760, 1900"
A911998,"ROGRE, MADRID, 1147, RAINWOOD, CIR, W, PALM, BEACH, GARDENS, FLA33410, 22326182"
A912134,"MARIA, A, HARVE, 161, LAWNVIEW, CIR, DANVILLE, CALI, 94526, 25480112, 1954"
A912144,"EDDIE, A, DAVIDSON, 9708, WALNUT, STRR, OAKLAND, CA, 94603, 26223176"
A912151,"AMRYANN, K, CORBIN, 2929, PEGASUS, DR, GARLAND, T, TEXAS, 75044, 1910"
A912159,"AMEY, N, REYNOLDS, 403A, DARDEN, HILL, RD, DRIFTWOOD, TX, 78619, 022302259, 22845"
A912161,"DAVY, T, LE, 11268, JOSHUA, CT, FONTANA, CA, 92337, PO, BOX, 2600, FONTANA, CA, 92334, 23052187"
A912186,"ANGELA, BULBUL, 20475, BISCAYNE, BLVD, G13, AVENTURA, FL, 33180"
A912203,"BRENT, G, WINSTEAD, 12568, 10TH, STRT, APT, J, CHINO, KCA, 91710, WPOST, 1211, CHINO, CA, 91708"
A912235,"KENNETH, NAVA, 12135, NW, 21ST, PL, MIAMI, FL, 33167, PO, OX, 430115, MWIAMI, FLA, 33243, 26876926"
A912279,"J, A, AGRED, 8608, GOLDFINCH, DR, BAKERSFIELD, CA, 93312, 022540139"
A912344,"EDDIE, A, DAVIDSON, 9915, TOYO, AVNUE, FONTANA, CA, 92335, PO, BOX, 2600, FONTANA, CALIFORNIA, 92334"
A912356,"RONNIE, M, WAIBEL, 17915, LOOKOUT, LAKE, CKIR, FLINT, TX, 75762"
A912438,"NICOLSA, K, PARTICK, 11030, BACALL, ROAD, W, JACKSONVILLE, FL, 32218, 22410669"
A912451,"SHELLIE, ZALDIVAR, 3937, NW, 29TH, LN, GAINESVILLE, FL, 32606, 22794179"
A912470,"SEAN, R, SHANZ, 1169, MADISON, CHAE, APT, 8, ROYAL, PALM, BEACH, FL, 33411"
A912507,"ALFONCINA, E, WALTERS, 12272, WARBLER, AVE, GRAND, TERRACE, CA, 92313, 26267471"
A912529,"CLARA, R, VETURA, 1823, RANCHO, LOMAS, WAY, SAN, MIGUEL, CA, 93451"
A912539,"BRENDA, B, KRIEGER, 9896, EBEN, NEVIS, BLVD, APT, 11, RIVERSIDE, CA, 92509, 24384689"
A912561,"L, ROBINSON, 913, SANFORD, DR, BAKERSFIELD, CALI, 93308, PO, BOX, 6010X3, BAKERSFIELD, CA, 93386"
A912593,"B, A, CALOV, 3254, SW, 57TH, CT, MIAMI, FL, 33155, PO, BOX, 430N115, MIAMI, FL, 33243"
A912624,"ROBERT, D, CEBALLOS, 1132, NORTHWEST, P89TH, TERR, PEMBROKE, PINES, FLA, 33024, PO, BOX, 245441, PEMBROKE, PINES, FL, 33024, 25536496, 19161224"
A912670,"MARY, AGUILERA, 1219, GLENN, AVE, MODESTO, CA, 95358, PO, BOX, 582052, MODESTO, CA, 95358, 021447688, 1909"
A912703,"SUSANNAH, T, JACOBSON, 7803, WRRIOR, AVE, SAN, ANGELO, TX, 76904"
A912741,"TESS, A, 4949, EAST, STATE, ROAD, 64, 309, BRADENTN, FLA, 34208, 21510965"
A912789,"R, M, BRACKLE, 1250, WRIGHT, DR, BLOSSOM, TX, 75416, 22345095, 28465"
A912796,"ESTHER, J, MELANCON, 822, SEYMOUR, WAY, PERRIS, CA, 92571, 11141"
A912864,"BRADCLEY, 1533, CANTERBURY, CIR, REDLANDS, CA, 92374, POS, 1166, REDLANDS, CA, 92373, 22480634"
A912885,"JASON, R, CHAVEZ, 13054, STAFFORDSHIRE, SDR, S, JAKSONVILLE, FL, 32225, 25146663"
A912900,"DUAEN, VLENTINE, 2000, CLUB, VIEW, CIR, CORINTH, TEXAS, 76210, 023312708, 19350722"
A912919,"PAMELA, FLORS, 25770, VISTA, FAIRWAYS, DRV, VALENCIA, CA, 91355, 23036428, 1972"
A912953,"DORIS, MENDEZ, 1411CANON, YEOMANS, TRL, AUSTIN, TX, 78748, 025209955"
A913011,"ANGEL, G, RODRIGUEZ, 380, ORLANDO, BLVD, PORT, CHARLOTTE, FL, 33954, BOX, 494163, PORT, CHARLOTTE, FLA, 33949, 23400736"
A913033,"ROGER, L, DALLAS, 5306, HARMONY, PL, KISSIMMEE, FL, 34758, 024875093"
A913076,"SANDOVAL, 16992, HINTON, CT, CASTRO, VALLEY, CA, 94546, PO, BOX, 20554, CASTRO, VALLEY, CA, 94546, 21784886"
A913118,"TINA, DICKS, 6025, DEIAS, AVE, SPC, 57, SACRAMENTO, CALI, 95824, 23963910, 1976"
A913178,"MARCELUS, V, STEVENS, 676THOMPSON, ROAD, SAN, ELIZARIO, TX, 79849"
A913293,"RANDLAL, M, HERNANDEZ, 7526, KILGARRY, AVE, PICO, RIVERA, CA, 90660, 25903462, 1932"
A913315,"BARBARA, L, LANTRIP, 6114, RANIER, DR, ORLANDO, FL, 32810, 25576915"
A913342,"JERRY, A, WASHINGTON, 564, S, 36TH, ST, GREENACRES, FL, 33463, 23223572"
A913345,"DAVID, W, JERDAN, 17750, SW, 154TH, ST, MIAMI, FL, 33187, 32615043"
A913353,"CRAIG, J, KELLER, 2327, SANSTONE, COURT, PALM, DALE, CA, 93551, 22742200"
A913358,"ALLY, PERALTA, 14967, CELRRITOS, PL, FONANA, CA, 92336, 025288749, 40436"
A913398,"DURAN, 211, RE, CHERCHE, ST, FORT, MYERS, FL33913, PO, BOX, 7586, FORT, MYERS, FL, 33911, 23703439"
A913427,"SHELLIE, ZALIDVAR, 3937, NW, 29TH, LANE, GAINESVILLE, FLA, 32606, 22974179"
A913465,"TONJA, R, RTUDO, 825, E, PALOMAR, ST, 1006, CHULA, VISTA, CA, 91911, 27218024, 43308"
A913466,"ALRRY, D, F, 1501, VISTA, RIDGEDR, FORNEY, TX, 75126, 024711885, 45618"
A913537,"MARIA, S, BAUER, 7851, SW, 106TH, AVE, MIAMI, FL, 33173"
A913556,"JULIO, D, ANTHONY, 24161, RANCHO, SANTA, ANA, ROAD, YORBA, LINDA, CA, 92887"
A913583,"SONNY, S, GAMAN, 9201, SEVEN, OAKS, LN, DENTON, TX, 76210, 26146381, 1935"
A913592,"MICEHLLE, A, FABIAN, 6016, BROADWNAY, OAKLANDH, CALI, 94618, POST, OFFICE, BOX, 18616, OAKLAND, CA, 94619"
A913604,"EUSTACIO, A, HOGAN, 2428, WHITE, HORE, RD, W, JACKSONVILLE, FL, 32246"
A913637,"TORRES, 6020, LA, PRADA, ST, APT1, LOS, ANGELES, CALI, 90042, 25857686"
A913670,"TC, H, SEXTON, 2900, HOPE, ST, WALNUT, PARK, CA, 9255, 22834147"
A913715,"RENE, A, CRANE, 3700, NW, 62D, AVENIDA, APT, 206, VIRGINIA, GARDENS, FLA, 33166, 28193102"
A913833,"CARMEN, C, ANGULO, 632, E, CENTER, STR, ANAHEIM, CA, 92805"
A913847,"TERESA, P, PITCHER, 8681, KATELALA, AVE, SPC, 858, STANTON, CA, 90680, PO, BOX, 121, STANTON, CA, 90680, 025029651"
A913911,"RANDY, R, F, 9T424, PROSPERITY, LAKE, DR, JACKSONVILLE, FLA, 32244, 27074858, 1901"
A913926,"TAMMIE, THOPMSON, 729, JEREY, DRIV, GONZALE, CALIF, 93926, 22431637"
A913935,"LEROY, S, CAJVINA, 2054, MONTECITO, AVENUE, APT, 20, MOUNTAIN, VIEW, CA, 94043"
A913963,"ANN, E, CARPENTER, 10859, CAMBAY, CIR, BOYNTN, BEACH, FL, 33437, PO, BO, 243722, BOYTON, BEACH, FLORIDA, 33424, 27010211"
A914010,"RENE, A, MELENEDZ, 3700, NW, 62ND, AVE, APT, 206, VIRGINIA, GARDENS, FLA, 33166, 21891302"
A914011,"BARBARA, A, SMITH, 38, EUCLID, AVE, APT, 102, MIAMI, BEACH, FLA, 33139, 23566960"
A914024,"D, L, FORD, 21132, LAMEDA, DEL, MONTE, WILDOMAR, CALI, 9595, 022657092, 1948"
A914063,"JOSE, M, GONZALEZ, 445, EL, CORONADO, AVE, BUCHANAN, DAM, TEXAS, 78609, 26331185, 1953"
A914090,"JANA, C, LOPEZ, 3831, CASTLE, ROCK, RD, DIAMOND, BAR, CALIFORNA, 91765, 23109505"
A914097,"JOHN, R, SMITH, 424, E, CENTRAL, BLVD, ORLANDO, FL, 32801, 23567984, 22656"
A914104,"SUZANNE, ARTENSETIN, 22562, THRUSH, ST, GRAND, TERRACE, CA, 92313, 27036049, 18061"
A914169,"ROSE, G, BONVENTRE, 2322, CANNERY, ROAD, WILDOMAR, CA, 92595, PO, BOX, 194, WILDOMAR, CA, 92595, 25351945"
A914246,"FERDINANDO, B, SILVEIRA, 570, RAMER, FORD, RD, PRIM, R, 72130, 24906191"
A914275,"VANESSA, C, PULIDO, 1105, CATALPA, CR, IRVING, TEXAS, 75063, POG, BOX, 154972, IRVING, TX, 75015, 26444831"
A914297,"TERRANCE, D, DE, LOS, 4513, DOGWOOD, CT, GRANBURY, TX, 76048"
A914307,"RINE, J, GUERRA, 7400, 37TH, AVE, N, SAINT, PETERSBURG, FLA, 33710, PO, BOX, 15632, SAINT, PETERSBURG, FL, 33733, 25350277"
A914361,"CAMREN, M, ARZIA, 2V0321, WESTPOINT, DR, RIVERSIDE, CA, 92507, 23789377"
A914374,"PEREZ, 2250, RIDGEWOOD, OURT, ROYAL, PALM, BEACH, FL, 33411, 22273220, 13536"
A914381,"ROBERTO, BRUCE, ATSON, 570, MOONEY, RD, NE, FORT, WALTON, BEACH, FL, 32547, 23911215, 1910"
