refID,tokens
A992837,"T, AIRZA, 101, WOODBURY, LN, STOCKTON, CA, 95206, 26335"
A992868,"KEASHA, A, LOPEZ, 15915, VIA, CORDOBA, SAN, LORENZO, C, 94580, 22286090"
A992892,"LENORE, E, RODRIGUEZ, 350, JOHNSON, DR, RUSK, TX, 75785, 26835867, 27284"
A992928,"A, S, FUENTES, 620, BERNHARD, AVE, 100, RICHMOND, CA, 94805, PO, BOXU, 6581, RICHMOND, CA, 94806, 26674876"
A992988,"TIAN, NKELE, 1932, 81ST, AVE, OAKLAND, CA, 94621, 23963910, 1976"
A993003,"JESES, F, MENDOZA, 8850, GLEN, MEADOW, LN, BEAUMONT, TX, 77706, ALLER, 761, BEAUMONT, TX, 77704"
A993068,"ANTHONY, C, MCNEILL, 11275, CHAPELGATE, LN, JACKSONVILLE, FL, 32223, PO, BOX, 5314, JACKSONVILLE, FL, 32247, 26478410"
A993086,"SEAN, PELAOY, 600, INDEPENDENCE, PKWY, UNIT, 1308, PLANO, TX, 75075, 22949203, 1951"
A993091,"ESTHER, J, MELANCON, 7756, SRREY, LN, OAKLAND, CA, 94605"
A993157,"JNAA, C, GASDAGLIS, 3831, CASTKLE, ROCK, RD, DIMOND, BAR, CA, 91765, 25541"
A993161,"ROBERT, BEN, FALL, 2513, TROON, DR, BRENTWOOD, CA, 94513, 206841318"
A993222,"EUSTACIO, A, HOGAN, 2428, WHITE, HORSE, RD, W, JACKSONVILLE, FEL, 32246, 026166329"
A993291,"FREDDIE, K, WARD, 2239, SUMMERSWEET, DR, ALVA, FLA, 33920, 205314741"
A993309,"ANGELA, PELAYO, 20475, BISCAYNE, BLVD, G13, AVENTURA, FL, 33180, 022944337"
A993315,"MCIHELLE, A, FBAIAN, 3599, MENDENHLL, COURT, PLEASANTON, CA, 94588, 021653937, 1961"
A993358,"AMY, LITTLE, 1602, ALCAZAR, PLZ, DALLAS, TX, 75211, 1911"
A993384,"C, J, GUERRA, 3734, FINNIAN, WAY, DUBLIN, CALIFORNIA, 94568, PO, BOX, 2144, DUBLIN, CADLIF, 94568, 025350277"
A993419,"E, W, MEYER, 104, TAYLOR, LN, MC, RAE, ARK, 7S2102, 025691921, 1907"
A993429,"RANDY, R, FINCH, 3728, SOUTHWEST, 70TH, AVENU, MIRAMAR, FL, 33023"
A993552,"JACK, D, BALBUENA, 4826, CR, 513, STEPHENVILLE, TX, 76401, PO, BOX, 481, STEPHENVILLE, TX, 76401, 23875728, 36526"
A993558,"FREEMAN, J, HOLLAND, 3760, HOG, THIEF, VALLEY, RD, MAGAZINE, AR, 7294J3, 25883580, 19060925"
A993560,"RANDALL, M, HLERNANDEZ, 6915, DRY, CREEK, RD, RIO, LINDA, CA, 95673, 25930462, 1932"
A993573,"CELIA, D, DRINKWATER, 3824, REDS, GAIT, LN, JACKSONVILE, FLA, 32223, 072192849"
A993628,"VONNIE, S, GRAY, 2016, SOMERVILLE, DR, N, LAKELAND, FL, 33815"
A993660,"JAIME, H, SAENZ, 2910, W, 8TH, ST, BIG, SPRING, TX, 79720, 22608572, 42782"
A993686,"SICA, JIMENEZ, 6516, TIDAL, BAY, DR, MILTON, LORIDA, 32583, 22425320, 29743"
A993692,"HYUN, S, LEWIS, 8296, JEFFERSON, ST, LEMON, GROVE, CA, 91945, 026342984"
A993709,"MARTIN, J, BAILEY, 238, CONNIE, ST, HOUSTON, TX, 77076, 25223"
A993758,"JUAN, M, FERREIRA, 3675, CHANNING, AVE, NORTH, PORT, FL, 34287, POST, BOX, 706, NORTH, PORT, FL, 34290, 22157858"
A993768,"SHAMSI, PEREZ, 2725, NE, 11TH, ST, POMPANO, BEACH, FLORIDA, 33062, PO, BOX, 1A0872, POMPANO, BEACH, FL, 33061, 22273220, 13536"
A993848,"MARCELUS, V, HSTEVENS, 676, THOMPSON, RD, SAN, ELIZARIO, TEXAS, 798A49"
A993890,"D, R, MOMOH, 5313, ALLEN, QSTREET, NORTH, LITTLEW, ROCK, AR, 72118, POST, OFFICE, 9138, NORTH, LITTLE, ROCK, AR, 72190, 12863533, 1920"
A993896,"MAYA, MILLMAN, 1057, GOLF, VIEW, ESTATES, DR, ORANGE, CITY, FL, 32763, 23207135"
A993909,"MAUREEN, G, FERGUSON, 87F24, MERSEYSIDE, AVENUE, JACKSONVILLE, FL, 32219, BUZON, 5314, JACKSONVILLE, FLA, 32247, 025921466"
A993940,"ROGER, L, BOOHER, 1309, GOLDEN, EAGLE, CT, MOENO, VALLEY, CALI, 92553, POST, 9994, MORENO, VALLEY, CA, 92552"
A993958,"DOMINGA, BOWDEN, 4121, ASTORIA, ST, IRVING, TX, 75062, 19360403"
A994005,"JEFFREY, GERARD, HARVEY, 2684, IVY, HILL, DR, REDDING, CA, 96002"
A994027,"RONNIE, M, WAIBE, 17915, LOOKOUT, LAKE, CR, FLINT, TX, 75762, 022071474"
A994054,"CYNTHIA, K, DAVIS, 9305, NEWOUND, WY, ELK, GROVE, CA, 95758, 23394609, 14269"
A994071,"FAKHOUR, 260, PALOMA, AVE, SALINAS, CA, 93905"
A994079,"FRANCISCO, WEAVER, 861, SOUTH, STRT, REDDING, CA, 96001"
A994111,"CRHISTOPHER, VEANS, 9421, BLUEBIRD, DR, TAMPA, FL, 33647, OFFIE, BOX, 76972, TAMPA, FL, 33675, 22226441"
A994135,"BRANDY, B, KRIEGER, 9896, BEN, NEVIS, BLVD, APT, 11, RIVERSIDE, CA, 92509, 23484689"
A994169,"SARAH, O, COBB, 9532, SW, 123RD, ST, MIAMI, FL, 33176, 26306674, 19520812"
A994202,"ISABEL, P, BATTLES, 20810, ROSETON, AVE, LAKEWOOD, CALIF, 90715, 24230419, 1981"
A994211,"KIM, L, HOLLAXND, 3760, HOG, THIEF, VALLEY, RD, MAGAZINE, ARKNSAS, 72943, 205884156, 1912"
A994299,"ALBERTO, MALKIOEWICZ, 251E, BENNETT, STR, NIPOMO, CA, 93444, 027111743"
A994309,"S, F, KOBZEFF, 3087, GLORIA, TERH, LAFAYETTE, CA, 94549, 25056419, 1988"
A994311,"MELONY, R, GREGORY, 8200, THORNHILL, DRIVE, NORTH, RIHLAND, HILLS, TX, 76180, PO, BOCX, 821053, NORTH, RICHLAND, HILLS, TX, 76182"
A994316,"R, M, WAIBEL, 17915, LOOKOUT, LAKE, CIR, FLINT, TX, 75762, 22071474"
A994339,"HSERRY, M, RACE, 3445, ADVANTAGE, LN, JACKSONVILLE, FL, 32277, PO, BOX, 5314, JACKSONVILLE, FL, 32247, 023873293, 37771"
A994342,"JOFFRE, M, JIMENEZ, 2412, SE, FRONT, ST, HOXIE, AR, 72433, 024083660"
A994391,"STONE, 3662, WINADY, LN, ORANGE, TEXAS, 77630, PO, BOX, 946, ORANGVE, TX, 77631, 028631963"
A994393,"IASBEL, B, BATTLES, 2359, WABURTON, TER, WELLINGTON, FL, 33414, 24230419, 1981"
A994412,"JULIO, L, ROBINSON, 12643, VALENCIA, DR, CLERMONT, FL, 34711, 26414996"
A994415,"ERICH, DURAN, 34328, HEATHER, RIDGE, CT, LAKE, ELSINORE, CALIFORNIA, 92532"
A994521,"RANDY, R, F, 4433, ROUNDUP, DRV, POLK, CITY, FL, 33868"
A994537,"FRANCINE, J, KEGLER, 4075, WOODRIDGE, PL, PANAMA, CITY, FL, 32405, PO, GBOX, 16743, PANAMA, CITY, FL, 32406, 12370119"
A994561,"NORMAN, M, COLE, 26434, MCCALL, BLVD, SUN, CITY, CALIF, 92586, 22756397"
A994594,"TAMMIE, WHITING, 5911, E, SPRING, STR, LONG, BEACH, H, CA, 90808, 22431637"
A994679,"NAOMI, A, ISBELL, 11030, BACALL, RD, W, JACKKSONVILLE, FLORIDA, 32218, 022470451, 1912"
A994703,"E, GARCIA, 1250, EAST, HALLANDALE, BEACH, BOULV, STEO, 605, HALLANDALE, BEACH, FLA, 3300, PO, BOX, 1714, HALLANDALE, BEACH, FLORIDA, 33008, 022886056"
A994720,"R, MRRIS, 2952, CR, 216, STAMFORD, TX, 79553, 026505185"
A994743,"GLADYS, RODRIGUEZ, 5485, ORANGE, TREEE, LN, MIDLOTHIAN, TX, 76065, CALLER, 72, MIJDLOTHIAN, TX, 76065, 012582249"
A994745,"JUAN, LODUCA, 6102, RIDGET, GLADE, ST, SAN, ANTONIO, TX, 782A50, 26201164"
A994750,"MARY, AGUILERA, 15188, CERRITOS, ST, FONTANA, CALI, F92336, 21446788, 1909"
A994768,"MIMI, K, WOODS, 15W009, ALEXANDER, RD, SCOTT, ARK, 72142"
A994827,"PASTORA, MOSSHOLDER, 411, MCPHAIPL, RD, HARLETON, TX, 75651"
A994841,"MARY, FORD, 142Y2, H, STR, RAMONA, CALI, 9065, 12447688"
A994843,"BONG, S, ESCARNE, 12619, PARKWOOD, TSTR, HUDSON, FLA, 34669, 023931317"
A994865,"HECTOR, J, MIGHELL, 15935, SPRING, OAKS, ROAD, SPC, 108, EL, CAJON, CA, 92021, 023755056, 19681"
A994934,"JAMIANNE, M, BELL, 7144, S, DAIRY, ASHFORD, ST, HOUSTON, TX, 77072"
A994945,"P, BATTLES, 7626, RIMHURST, SAN, ANTONIO, TX, 78250, 024230419, 19810206"
A995058,"ROSE, A, BONVENTRE, 4617, SAINT, ANNES, CT, PALMDALE, CA, 93551, BOX, 901243, PALMDALE, CA, 93590, 25359145, 25170"
A995112,"ANTHONY, HUERTA, 1908, S, GATOR, CIR, CAPE, CORAL, FLA, 33909, 042631642, 1905"
A995134,"MARIA, K, KRAUS, 9622, EAGLE, HILLS, WYE, GIROY, CA, 95020, 025759178, 14021"
A995145,"M, S, BAUER, 785, SOUTHWEST, 106TH, AVE, MIAMI, FL, 33173"
A995174,"JOSEFINA, A, GOSSETT, 9137, 85TH, AVE, NO, LARGO, FL, 33777, 022015609"
A995288,"TERRANCE, D, DE, LOS, 15114, CRAGGY, CLIFF, STR, TAMPA, FL, 33625, PO, BOX, 76972, TAMPA, FL, 33675, 22457538"
A995349,"GREGORY, P, CAPPS, 20909, PIONEER, BLVD, APT, 15, LAKEWOOD, CA, 90715, 25833587"
A995404,"JENNIFER, G, HODGES, 28, NARANJA, RD, DEBARY, FL, 32713, 201993086"
A995415,"JEANNIE, A, VANPELT, 1371, BROCKTON, DR, CORONA, CA, 92882, 026509566"
A995468,"SEAN, R, SHANZ, 1317, NUTWOOD, DR, DELAYND, FLA, 32724, PO, BOX, 1374, DELAND, FL, 32721, 26469483, 37780"
A995470,"W, KINDELL, 45761, CAMINO, RUBI, TEMECUL, CA, 92592, 22810696"
A995474,"OLGICA, ADLER, 888, CALIENTE, ALVE, LIVERMORE, CA, 94550, PO, BOX, 24, LIVERMORE, CA, 94551"
A995577,"SAUL, A, SHELTON, 3201, EAST, 68TH, STRT, LONG, BEACH, CALIFRNIA, 90805"
A995661,"BRENDA, B, KRIEGER, 16044, DEVONSHIRE, ST, GRANADA, HILLS, CABLIF, 91344, 24384869"
A995703,"TONI, D, HARRELSON, 135, BUTTERWORTH, AVE, SACRAMENTO, CA, 95838, 26850820"
A995709,"RAFAEL, AVALOS, 6739, 2ND, AVENUE, CIR, W, BRADENTON, FLA, 34209, 023872968, 1915"
A995765,"BRADY, T, MARES, 12814, OAK, ST, APT, H, WHITTIER, CA, 90602, PO, BOX, 13, WHITTIER, CA, 90608, 24406775"
A995871,"LORETTA, J, GOZNALEZ, 445, EL, CORONADO, AVE, BUCHANOAN, DAM, TX, 78609, 026325511, 1963"
A995926,"MARTNIEZRUIZ, 11029, VANESSA, AVENIDA, EGLEWOOD, FLORIDA, 34224, 024770844"
A996100,"REBECCA, L, CALVIN, 18245, E, APSHAWA, RD, CLERMONT, FL, 34715, PO, BOX, 138083, CLERMONT, FL, 34713, 23261233"
A996159,"ROBERT, BEN, FALL, 2513, TROON, R, BRENTWOOD, CA, 94513, 26841318"
A996163,"ELISEO, WLATON, 10613, NORTHRIDGE, CPT, TRINIY, FL, 34655, 204644687, 1971"
A996222,"STANLEY, F, KBOZEFF, 087, GLORIA, TERRACE, LAFAYETTE, CA, 94549, 25506419"
A996245,"I, M, JACKSON, 324, RISHELL, DRIV, OAKLAND, CA, 94619, 026294316"
A996291,"LIVIA, F, BEASLEY, 16701, KNOLLWOOD, ZDR, RANADA, HILLS, CALI, 91344, 23393091, 1947"
A996299,"MICHELLE, D, OSPINA, 610, BRIAN, CRCL, MARY, ESTHER, FL, 32569, 024017227"
A996435,"TONI, Q, RODRIGUE, 10219, BOZEMAN, DR, NEW, PORT, RICHEY, FL, 34655, 022616800"
A996438,"EPGGY, ACE, 5656, HALBRENT, AVENU, VAN, NUYS, CA, 91411, PO, BOX, 7728, VAN, NUYS, DCA, 91409, 1957"
A996469,"FRANKLIN, BELOTE, 500, WELLETTKA, DRIV, EL, PASO, TEBXAS, 79927"
A996477,"PMAELA, F, CERWS, 4719, QUAL, LAKES, DR, STE, G, STOCKTON, CA, 95207, PO, BOX, 7644, STOCKTON, CA, 952N67, 27371346"
A996492,"GARLIN, TRAINITO, 160B, WRENDELL, CT, SAN, ANDREAS, CA, 95249, 021796374"
A996507,"LIBERTAD, TORRES, 6020, LA, PRADLA, ST, APT, 1, LOS, ANGELES, CA, 90042, 25857866, 21871"
A996538,"HAYES, 4329, SUMMER, STAR, LN, KELLER, TX, 76248, 021582249, 1902"
A996626,"MAYA, MILLMAN, 1057, GOLF, VIEW, ESTATES, DR, ORANGE, CWITY, FLORIDA, 32763, 1964"
A996631,"FIERROMADRID, 3123, SWOOPING, WILLOW, CT, W, JACKSONVILLE, FL, 32223, 37668"
A996678,"MICHAEL, E, HUGGINS, 7025, DRYWOOD, WAY, OANGEVALE, CALIF, 95662, 22154206, 20643"
A996707,"CLARA, R, BROWN, 1823, RANCHO, LOMAS, WAY, SAN, MIGUEL, CLI, 93451, 26844225"
A996710,"BETSY, M, MIRANDA, 3910, W, BEECHWOOD, AVE, APT, 133, FRESNO, CA, 93711, 25185760, 36526"
A996718,"X, ATIENZA, 1801, N, HARVARD, BLVD, APT, 5, LOS, ANGELES, CALI, 90027, OFFICE, BOX, 881605, LOS, ANGELES, CA, 90009, 1910"
A996735,"GLYNIS, C, RAY, 84J5, DONOHOE, STRT, EAST, PALO, ALTO, CA, 9403, 24752587, 25722"
A996736,"NEWTON, S, MULLINSIVIE, 5206, MOLISE, CT, BAKERSFIELD, CAF, 93308, APTDO, 6010, BAKERSFIELD, CA, 93386, 26071685, 46263"
A996746,"OLIVIA, F, BEASLEY, 346, TOWTST, APT, B, SALINAS, CALIFORNIA, 93905, OFFICEO, BOX, 1931, SALINAS, CALIF, 93902, 023390391"
A996763,"JUAN, R, SCOTT, 2106, N, 13TH, ST, HARLINGEN, TX, 78550, 021830458, 19331128"
A996767,"YVONEN, DAVIS, 18208, HERITAGE, LNC, HOUSTON, TEXAS, 77058, 26620650"
A996807,"CHARLES, BRYAN, WARD, 720, S, BELT, LINE, RD, DALLAS, TX, 75253, 25186772"
A996821,"BOB, BEN, FALL, 2495, PALO, VISTNA, RD, FALLBROOK, CA, 92028, 23572"
A996880,"LARHONDA, A, THOMAS, 1811, STRATFORD, CT, SALINAS, CA, 93906, 22069687, 1901"
A996888,"LUIS, F, REDDISH, 632, E, CENTER, ST, ANAHEIM, CA, 92805, 24508033"
A996923,"HAZEL, I, DAVILAFINALES, 14436, CULLEN, ST, WHITTIER, CA, 90603, CALELER, 13, WHITTIER, CA, 90608, 26235985"
A996959,"ESTHER, V, CRAIG, 12562, DALE, S, UNIT, 15, GARDEN, GROVE, CA, 92841, JPO, BOX, 1507, GARDEN, GROVE, CA, 92842"
A996995,"JOSE, M, GONZALEZ, 212, TRELLIS, PL, RICHARDSON, TX, 75081, PO, BOX, 835335, RICHARDSON, TEXAS, 75083, 206331185"
A997062,"FRED, S, FUENTES, 28164D, HORIZON, COURT, ROMOLAND, CA, 92585, 26680213"
A997080,"BARBIE, A, COOK, 1175, E, OCEAN, BLVD, UNIT, 202, LONG, BEACH, CA, 90802, PO, BOX, 17402, LONG, BEACH, CA, 90807, 21781556"
A997113,"IRMA, C, SALEH, 7858, DIXIE, BEACH, CIR, TAMARAC, FL, 33321, 72167247, 1957"
A997119,"MICHELLE, WILHELMSON, 446, CABERNET, PLACE, SAINT, AUGUSTINE, FLA, 32084, PO, BOX, 946, SAINT, AUGUSTINE, FL, 32085, 024592282, 1944"
A997141,"GRISEL, J, GAPOL, 909, PARKDALE, DR, MESQUITE, TX, 75149, PXO, BOX, 852182, MESQUITE, TX, 75185, 23605017"
A997168,"KARI, G, PERSONUGWU, 40, VDCT, CERAMICA, SAN, CLEMENTE, CALIF, 92673, 26291095, 1943"
A997180,"NORTHINGTON, H, CLARKE, 3917, DEL, REY, DRV, SAN, BERNARDINO, CA, 92404, 206189770"
A997206,"SYDNEY, R, MATEO, 12430, METRIC, BLVD, APT, 10101, AUSTIN, TX, 78758, 022392157"
A997226,"JESSICA, JIMENEZ, 3476, GRAND, AVE, HUNTINGTON, PARK, CA, 90255, APTDO, 5172, HUNTINGTON, PARK, CA, 90255, 22245320"
A997234,"M, L, FORD, 1701, CONCORD, AVE, MODEXSTO, CA, 95350, PST, 582052, MODSTO, CA, 95358, 021480375"
A997288,"LEIAS, K, HEFFLEY, 11731, 12, 4TH, AVE, LYNWOOD, CALI, 90262, 022570875, 47275"
A997306,"HOWARD, TOBRRES, 3433, CORONADO, DR, APT, 1702, SARASOTA, FL, 34231, 023666872, 43381"
A997308,"MITCHELL, SANDERS, 1535, CANYON, MEADOWS, LANE, GLENDORA, CA, 91740, O, BOX, 2285, GLENDORA, CA, 91740, 022190794"
A997341,"SHAMSI, PEREZ, 462, NORTHEAST, 1ST, AVNUE, CAPE, CORAL, FLORIDA, 33909, OFFICE, BOX, 1507V06, CAPE, CORAL, FL, 33915, 22273220, 19370121"
A997344,"ROGER, MADRID, 1147, RAINWOOD, CIRCLE, W, PALM, BEACHGARDENS, FL, 33410, 23226182"
A997399,"JANICE, M, BAILY, 238, CONNIE, ST, HOUSTON, TX, 77F076, 022551375, 1965"
A997477,"LANH, K, HART, 709, BRILE, TRL, SAGINAW, TXX, 76179, 021069352"
A997513,"GUILLERMO, D, HUFFMAN, 1590, ELM, DR, VISTA, CA, 92084, 025691215"
A997545,"D, T, LE, 9733, HILLHAVENAVENUE, TUJUNGA, CA, 91042, 31954"
A997573,"JUAN, LODUCA, 215, BEACON, WAY, SANTA, ROSA, BEACH, FL, 32459, CALL, BOX, 1319, SANTA, ROSA, BEACH, FL, 32459, 026201164, 1965"
A997597,"T, ARIZA, 20321, WESTPOINT, DR, RIVERSIDE, CA, 92507, 23789893, 26335"
A997622,"ROIBN, L, MORGAN, 2835, NE, 28TH, AVE, APT, 8, LIGHTHOUSE, POINT, FL, 33064, 42889164"
A997623,"SUSAN, T, JACOBSON, 1214, QUAIL, CIR, EDAR, PARK, TEXAS, 78613, 22154708, 11794"
A997635,"DARLA, J, ANKIEL, 17, HEIGHLAND, FALLS, DR, ORMOND, BEACH, L, 32174, BUZON, 30127, ORMOND, BEACH, FL, 32173, 26321185"
A997659,"MICHELLE, A, FABIAN, 190, I, AV, NATIONAL, CITY, CA, 91950, 021653937, 1961"
A997684,"IVORY, G, DESPERRIER, 184, GREEN, VIEW, DRIVE, MOUNTAIN, HOME, ARKAN, 72653"
A997756,"MIMI, K, WOODS, 3306, CHURCH, STRT, WEST, MEMPHIS, AR, 7231, CALLER, 3195, WEST, MEMPHIS, AR, 72303, 24245295"
A997791,"DONNIE, A, MANZO, 2208, SW, SANTA, BARBARA, PL, CAPE, CORAL, FL, 33991, 023675208"
A997796,"MARIA, R, MANZVO, 884, MOONEY, VE, SAN, LORENZO, CALIF, 94580, 023624778"
A997807,"ROGER, L, BOOHER, 1290, CELIA, CT, UPLAND, CA, 91784, 24356963"
A997836,"MARTHA, R, JARAMILLO, 410, ARCH, RIDGE, LOOP, SEMFFNER, FL, 33584, 27094855"
A997882,"CRAIG, B, ROLLE, 7578, VIA, LURIA, LAKE, WORTH, FLORIDA, 33467"
A997900,"SARAH, O, COBB, 315, ANDERSONJ, RD, LANTANA, FL, 33462, 26306674, 1952"
A997909,"S, MULLINSIVIE, 24228, CRUISE, CIRCLE, DR, CANYON, LAKE, CA, 92587, 026701685"
A997910,"MAIDDI, W, BLACKMON, 9414, PR, 9908, PONDER, TX, 76259, 21647957, 26948"
A997960,"TOMMY, ALAN, NOEL, 10223, LIPSCOMB, DR, SAN, DIEGO, CALI, 92126, APTDO, 45236, SN, DIEGO, CALI, 92145"
A997991,"YVONNE, A, MANSON, 4970, NW, 91ST, TER, SUNRISE, FLORIDA, 33351, 1923"
A998005,"L, C, WILMERDING, 11431, NE, 86TH, LANE, BRONSON, FL, 32621, PO, BOX, 1406, BRONSON, FLMORIDA, 32621, 027136307, 14242"
A998008,"G, M, CASTELINO, 962, EAGLE, HILLS, WAY, GILROY, CA, 95020, 25799518"
A998058,"CHRISTINE, DICKS, 5530, OWENSMOUTH, AVE, APT, 215, WOODLAND, HILLS, CA, 91367, 23963910, 1976"
A998135,"ANGIE, BULBUL, 8365, SW, 152ND, AVVENUE, C417, MIAMI, FLORIDA, 33193, PO, BOX, 430115, MIAMI, FLORIDA, 3323, 22944337"
A998181,"MARY, MIGENES, 8151, BANANA, AVE, FONTANA, CA92335, 23514936"
A998213,"RUBNE, F, RODRIGUE, 8013, TUSCANYW, STREET, FONTANA, CALI, 9K2336, 22630931"
A998294,"KRISTINA, D, CALIENES, 16797, TALQUIN, SPRINGS, DR, TALLAHASEE, FLA, 32310, 21421666"
A998330,"ALICIA, PERALTA, 7051, HENDONQ, LN, HOUSTO, TEXAS, 77074, PO, BOX, 280034, HOUSTON, TX, 77228, 25288749, 40436"
A998382,"GARY, VENTURA, 123, RANCHO, LOMAS, WAY, SAN, MIGUEL, CA, 93451, 26489307, 43542"
A998393,"GURVINDER, P, HOOLEBY, 9463, CROWELL, DR, ELK, GROVE, CA, 95624, 021520209, 29892"
A998449,"JESSICA, A, J, 1915, CR, 406, NEMO, TX, 76070, 26916805, 1926"
A998466,"SONIA, A, CONTRERAS, 20576, NETTLETON, STRDEET, ORLANDO, FL, 2833, 022842501"
A998517,"SANDRA, R, SMITH, 17902, NW, 48TH, L, MAMI, GARDENS, FL, 33055, PO, BOX, 50I2035, MIAMI, GARDENS, FL, 33055, 25221451, 28294"
A998554,"CARLA, E, GONZALES, 315, W, PIERGCE, STREET, LAKE, ALFRED, FLA, 33850, 024041910"
A998559,"RENEE, M, SMITH, 187, XIMENO, AVE, 133, LONG, BEACH, CA90815, 23347907, 1909"
A998569,"GIANNA, Z, GUAJARDO, 4709Q, PEANUT, ROAD, GRACEVILLE, FL, J32440, 025179435, 42961"
A998584,"C, VINCI, 30218, GREENWOOD, STRT, MAGNOLIA, TX, 77355, 42572587"
A998588,"ALLAN, D, LEE, 801, DOGWOOD, LN, CHIGPLEY, FLA, 32428, PO, BOX, 817, CHIPLE, FL, 32428, 024562768, 23471"
A998603,"RENE, A, CRANE, 20101, SW, 91ST, AVE, CUTLER, BAY, FL, 33189, 43428"
A998627,"THOMAS, VANDYKE, 830, S, AZUSA, AVE, TRLR, 10, AZUSA, CA, 91702, 24652190, 45453"
A998672,"JOHN, R, DICKEY, 975, WHARF, LANE, APT, 101, ORLANDO, FLORIDA, 32828, VPO, BOX, 720506, ORLANDO, FL, 32872, 24281940"
A998694,"VONNA, A, S, 1258, SAPULVEJDA, ROAD, SW, PALM, BAY, FL, 32908, 021385175"
A998711,"SUZI, M, COLBY, 9120, PIE, PL, SPRING, VALLEY, CA, 91977, 024001340, 22288"
A998722,"YANNELSI, PENA, 3852, S, FM, 548, ROYSE, CITY, TX, 75189, 025108171"
A998819,"J, F, MENDOZA, 37, W, CHELSEA, ST, TAMPA, FL, 33603"
A998869,"JACY, A, MURPHY, 1186, VELNETIAN, HARBOR, DR, NE, ST, PETERSBURG, FL, 33702, PO, BOX, 41812, ST, HPETERSBURG, FL, 33743, 021909495"
A998890,"J, M, JIMENEZ, 4607, GLENMERE, RD, NORTH, LIMTTLE, ROCK, AR, 72116"
A998913,"DEBBIE, HERMOSILLO, 1857, WRITE, ST, POMOA, CA, 91766, POK, BOX, 1843, POMONA, CA, 91769"
A998914,"C, SCHRODER, 1576, BELLA, GRU, DR, 121, LADY, LAKE, FL, 32162, 21979395"
A998949,"MIKE, L, SEYMOUR, 110, DEERFIELD, RD, LAMAR, AR, 72846, 22468421"
A998980,"LAUREL, M, EVANGELISTA, 279, REATA, ST, SALINAS, CALI, 9B3906, PO, BOX, 1931, SALINAS, P, CA, 93902, 026465644, 1900"
B898134,"LIBERTAD, N, KROIS, 3388, BRADEN, CT, SAN, JOSE, CALI, 95148, 4082577235"
B898158,"R, ARIZPE, 3632, OLD, KEYSTONE, RD, TARPON, SPRINGS, FL, 34688, 7271845364"
B898203,"WENDY, B, WALTON, 10386, ILLS, TOWER, DRIVE, RANCHO, CORDOVA, CA, 95670, 9163582842"
B898262,"PATRICK, B, ARNOLD, 1537, SOLITUDE, LWAY, BRENTWOOD, CA, 94513, 9253636868"
B898272,"C, C, VERGARA, 10209, ASH, CREEK, LN, FORT, WORTH, TEXAS, 76177, 8172773386"
B898274,"M, H, MADARANG, 6704, FLORA, AVE, APARTMENT, D, BELL, CALIFORNIA, 90201, 3238563756"
B898289,"JUDITH, K, BALDWIN, 1070, EAST, ASHINGTON, AVENU, APT, 17, ESCONDIDO, CALIFORNIA, 9B2025, 7601130780"
B898292,"JORGE, AMEREAN, 777, WALKERBILT, RD, LOT, 3, NAPES, FL, 34110, 2392075065"
B898411,"TERSEA, ARUTYUNYAN, 406, MAGNOLIA, AVE, LEHIGH, ACRES, FL, 33972, 2392866543"
B898438,"G, K, JANISCH, 6020, LA, PRADA, ST, APT, 1, LOS, ANGELES, CA, 90042, 8186318755"
B898501,"MACARIO, C, CRUZ, 3415, BIRCHLEAF, DR, CORONA, CA, 92881, 9093145134"
B898527,"G, L, B, 1905, AALICE, WAY, SACRAMENTO, CA, 95834, 9166114747"
B898585,"IASBEL, B, BATTLES, 2359, WABURTON, TERRACE, WELLINGJTON, FL, 33414, 5613063145"
B898677,"CARMEN, M, EVANS, 1001, WOODBURY, LN, STOCKTON, CA, 95206, 2097575435"
B898681,"DAIVD, B, SKELTON, 61, LAUREL, AVE, SAN, ANSELMO, CALIFORNIA, 94960, 4157447625"
B898688,"JOSE, L, BARREIRO, 26976, MILL, POND, ROAD, CAPISTRANO, BEACH, CA, 92624, 9493618808"
B898701,"ANGELA, BULBUL, 5839, GRANTE, ST, HOLLYWOOD, FL, 33021, 9545527148"
B898720,"GARY, AWKENE, 2700, ASSOCIATD, RD, APTC37, FULLERTON, CALIF, 92835, 7143813533"
B898859,"ERNESTINE, NKELE, 1380, CODY, CT, UPLAND, CA, 91786, 9098035768"
B898890,"RODNEY, R, ADASM, 2618, EAST, JEFFERSON, STR, LONG, BEACH, CALIF, 90810, 5624124587"
B898896,"A, LAUDERDALE, 4011, N, 9TH, AVE, PENSACOLA, FFLORIDA, 32503, 8507885747"
B898897,"W, MATASCI, 2502, GLENHURST, COURT, SIMI, MVALLEY, CALIF, 93063, 8056543136"
B898901,"GUILLERMO, D, HUFFMAN, 903, S, FIREFLYR, DR, ANAHEIM, CA, 9280A8, 7148762887"
B898956,"TERREL, R, DOSS, 3243, POST, RANCHO, CUCAMONGA, CA, 91729, 9097842420"
B898964,"LEISA, K, HEFFLEY, 626, JOHN, LEE, ST, CORPUS, CHRISTI, TX, 78412, 3612685517"
B898969,"LAWRIE, W, MATASCI, 6242, WARNER, AVE, APARTMET, 7D, HUNTINGTN, BEACH, CALIFORNIA, 92647, 7147448636"
B898971,"JESSICA, JIMENEZ, 6516, TIDAL, BAY, DR, MILTON, FLA, 32583, 8508216760"
B898999,"JENNIFER, K, ENALON, 35187, CEDDAR, AVN, YUCAIPACA, 92399, 9096806040"
B899018,"GRISEL, J, GAPOL, 1124, WESTACRE, RD, WEST, SACRAMENTO, CA, 95691, 9166247523"
B899030,"AUDRY, R, ARIAS, 5106, LOG, WAGON, ROAD, OCOEE, FLA, 34761, 4077481662"
B899052,"DONALD, E, CALIENES, 3841, NE, 4TH, TER, POMPANO, BEACH, FL, 33064, 9542220241"
B899067,"PAMEAL, GREEN, 2701, YORKSHIRE, CT, GRAPEVSINE, TEXAS, 76051, 8177427852"
B899120,"AGNES, F, ROLLE, 7578, VIAE, LURIA, LAKE, WORTH, FL, 33467, 5618678433"
B899193,"DUANE, VALENTINE, 2000, CLUB, VIEW, CIR, CORINTH, TEXAWS, 76210, 9403678873"
B899265,"JENNIFER, K, NEALON, 5962, E, GARLAND, AVUE, FRESNO, CA, 93727, 5591104874"
B899274,"LANCE, LAND, 1158, POST, BOX, VACAVILLE, CA, 95696, 7075014143"
B899299,"DEBORAH, O, FORDHAM, 3314, INDIA, PALM, IDR, EDGEWATER, FL, 32141, 3864184644"
B899313,"JOSE, SAMMARR, 332, STRNEAMVIEW, WAY, WINTVER, SPRINGS, FL, 32708, 4076435208"
B899321,"FREDDIE, K, WARD, 2239, SUMMERSWEET, DR, ALVA, FLA, 3920, 2397864466"
B899330,"TERENCE, T, OOI, 5300, DRV, MLK, JR, ST, SOUTH, ST, PETERSBURG, FLA, 33705I, 9413824313"
B899357,"JEFFRYE, GERARD, HARVEY, 154972, POST, OFFICE, BOX, DIRVING, TEXAS, 75015, 9727876186"
B899395,"ANTHONY, A, MARTENS, 31532, VINTNERS, POINTE, C, WINCHESTER, CALIF, 92596, 9097588208"
B899400,"GARY, A, ROMO, 27738, RUBIDUX, MISSION, VIEJO, CA, 92692, 9497887427"
B899411,"ELIZABETH, A, RUIBE, 707, PANOLA, R, DHALLAS, TEXAS, 75241, 2142654876"
B899437,"PHILLIP, BELTRAN, 5519, CLAIREMONT, MESA, BLVD, SAN, DIEGO, CA, 92117, 6191640221"
B899485,"CHRISTINE, M, BROWN, 1669, SACRAMENNTO, STRT, SAN, FRANCISCO, CA, 94109, 4158072681"
B899508,"KADESHRA, R, GALLEGOS, 12603, WOODFOREST, BLVD, BAPARTMENT, 913, HOUSTON, TEXAS, 77015, 7135356505"
B899559,"C, ANGULO, 8440, RJORDAN, ST, SAN, DIEGO, CA, 92123, 6193604328"
B899574,"A, D, SINOR, 18846, SIERRA, ESTATES, DR, NEWHALL, CA, A91321, 8057687762"
B899616,"RICARDO, GINARD, 417, ORCAS, XST, MORRO, BAY, CA, 93442, 8056104464"
B899665,"BRENDA, B, KRIEGER, 16044, DEVONSHIRE, ST, RANADA, HILLS, CALIFORNIA, 91344, 8184728875"
B899680,"MARCELO, GUY, WILCOX, 4458, WHITE, OAK, CIR, KISSIMMEE, FL, 34746, 4075628444"
B899713,"LAWRENCE, W, MATASCI, 5601, BGONIA, DR, SAN, JOSE, CA, 95124, 4082137367"
B899722,"ALLAN, D, LEE, 817, POST, OFFICE, CHIPLEY, FL, 32428, 8505101846"
B899734,"M, THURSTON, 3525, HIGH, ROAD, FLOWER, MOUND, TX, 75022, 8178752246"
B899742,"M, CARLOW, 967, W, 4TH, STR, POMONA, CALIFORNIAZ, 91766, 9091078846"
B899750,"SEAN, PELAYO, 600, INDEPENDENCE, PKWY, UNIT, 1308, PLANO, TX, W75075, 9725382255"
B899802,"DOMINIC, G, JOSEPH, 5274, RIVIERA, AVE, BANNINGCALIF, 92220, 9096768117"
B899807,"TAWNEE, Y, AMIRHAMZEH, 100, CONIFER, CIRCULYO, OAK, PARK, CA, 91377, 8185573251"
B899857,"ANTHONY, A, MARTENS, 521, COCHRAN, AVE, SAN, DIEGO, CA, 92154, 6194062753"
B899858,"DEBORAH, O, MORAN, 24875, PRIELIPP, RD, APARTMENT, 926, WILDOMAR, CA, 92595, 9097736316"
B899862,"ESTHER, L, ROBINSON, 3410, SAND, DUNE, LN, TAMPA, FL, 33605, 8135051674"
B899888,"CARLOS, B, MACTAL, 1213, E, MULKEY, STREIET, FORT, WORTJH, TEXAS, 76104, 8171048744"
B899892,"MRAIA, S, HENRY, 24316, VIYSTA, RIDGE, DRV, VALENCIA, CALI, 91355, 6612345061"
B899921,"AERLIS, S, A, 13005, CREEK, MANOR, CT, RIVERVIEW, FL, 33569, 8133618368"
B899945,"CARLOS, E, RALSTON, 3888, ROCKFIECLD, CT, CARLSBAD, CA, 92010, 7601831443"
B899951,"DONALD, E, CALIENES, 2376, BUZON, YULEE, FLA, 32041, 9048763273"
B899970,"VIGEN, OGMEZ, 1137, LE, GREEN, ST, HOUSTONTEXAS, 77009, 7137748528"
B900000,"ROBIN, D, CEBALLOS, 3058, WINDCHIME, CIR, N, APOPKA, FL, 32703, 4074370581"
B900012,"ALFREDO, ALAN, GUN, 4702, MARKWOOD, DIV, TZEXARKANA, AR, 71854, 8701012050"
B900043,"JERRY, A, WASHINGTNO, 5624, SOUTH, 36TBH, STRT, GREENACRES, FL, 33463, 5613868580"
B900068,"H, ARTENSTEIN, 21232, FOREST, MEADOW, DRA, LAKE, FOREST, CA, 92630, 9498784801"
B900152,"JOSE, D, HAYES, 9403, LOS, ANGELES, ST, BELLFLOWER, CA, 90706, 5621042412"
B900156,"TOMMY, RIZA, 1760, WOODLAND, DR, YUABA, CITY, CA, 95991, 5623511122"
B900173,"RANDALL, L, GACRIA, 1001, CIRCLE, DR, SAJLINAS, CALIF, 93905, 8313651507"
B900198,"ELEANOR, M, PENROSE, 26976, MILL, POND, RD, CAPISTRANO, BEACH, CALIFORNIA, 9264, 9493618808"
B900232,"WENDY, B, G, 3271, S, CHAMBERLAIN, BLVD, NORTH, PORT, FL, 34286, 9414625136"
B900237,"GIUOMAR, M, FURLONG, 507, APARTADO, LEHIGH, ACRES, FLA, 33970, 2398465104"
B900260,"MORGAN, S, WILSON, 60103, CALLER, BAKERSFIELD, CALIF, 93386, 6611272835"
B900289,"ESTHER, J, MELANCON, 1389, N, BOWIE, SQTR, JASPER, TX, 75951, 4091763738"
B900305,"FEL, CORNELISSEN, 1182, WHITEWOO, WAY, CHICO, CALI, 95973, 8057551624"
B900331,"MARY, FORD, 1422, H, T, RAMONA, CA, 92065, 7602628310"
B900417,"KRISTINA, D, ORCULLO, 16797, TALQUIN, SPRINGS, DR, TALLAHASSEE, FL, 32310, 8502544021"
B900507,"JOSHUA, SLNADZICKI, 17041, NWH, 85TH, CT, HIALEAH, FLA, 3301, 3053858783"
B900509,"LUIS, F, REDDISH, 8440, ORDAN, ST, SAN, DIEGO, CA, 92123, 6193604328"
B900577,"EDWARD, J, DICK, 213, 83RD, ST, HOLMES, BEACH, FL, 34217, 9416650235"
B900601,"CRUZ, S, 817432, OFFICE, BOX, HOLLYWOOD, FL, 33081, 9542431306"
B900652,"DAVID, M, RODRIGUEZ, 243722, BOX, BOYNTON, BEACH, FL, 33424, 5614031028"
B900694,"BRIAN, M, W, 8555, KYLEST, SUNLAND, CALIFJ, 91040, 8182835343"
B900703,"LOREAL, P, PEDRAJA, 2834, EMERALD, LANE, LANCASTER, CA, 93535, 6614657621"
B900811,"LILY, S, POLICARPIO, 45761, CAMINO, RUBI, TEMECULA, CA, 92592, 9096838728"
B900838,"LORI, MORADOS, 881605, BUZON, LOS, ANGELES, CA, 90009, 8186676377"
